,AUT,AUS,BEL,BGR,BRA,CAN,CHN,DEU,ESP,FRA,GBR,HUN,IDN,IND,IRL,ITA,JPN,KOR,MEX,NLD,NOR,POL,PRT,ROU,RUS,TUR,TWN,USA,REU,RoW
IRL Land transport and transport via pipelines,0.0,0.2,1.7,0.0,0.0,0.1,0.1,5.5,0.8,1.3,5.8,0.0,0.0,0.0,1665.7,1.3,0.1,0.1,0.0,0.3,0.0,0.1,0.4,0.0,0.4,0.1,0.0,0.4,1.3,57.3
IRL Water transport,0.0,0.0,0.0,0.0,0.0,0.0,0.0,0.4,0.0,0.0,3.3,0.0,0.0,0.1,199.9,0.0,0.0,0.0,0.0,0.1,0.0,0.0,0.1,0.0,0.0,0.0,0.0,0.0,0.3,55.5
IRL Air transport,0.0,0.7,5.4,0.0,0.3,1.5,1.2,20.8,15.5,26.5,212.7,0.4,0.1,1.7,102.1,25.8,0.9,0.6,0.3,3.2,1.2,0.2,13.4,0.0,0.9,0.2,0.5,39.3,14.0,119.9
IRL Warehousing and support activities for transportation,0.1,0.2,9.8,0.0,0.1,0.0,0.0,24.4,3.1,7.3,8.7,0.1,0.0,0.2,90.2,4.7,0.0,0.4,0.0,0.2,0.3,0.1,2.5,0.0,0.5,0.0,0.4,0.0,3.5,30.2
IRL Postal and courier activities,0.0,1.2,0.9,0.0,0.2,0.0,11.3,5.1,2.5,1.2,60.7,0.2,0.0,0.0,52.8,1.7,0.1,0.1,0.0,5.7,0.0,0.7,0.3,0.0,0.0,0.0,0.1,0.0,2.5,120.1
IRL Accommodation and food service activities,6.4,10.2,15.6,0.1,6.3,15.3,0.5,62.4,9.1,0.0,847.7,1.6,0.6,0.0,3875.7,32.6,6.9,0.9,0.1,0.0,0.0,0.0,46.5,0.1,0.1,0.0,3.7,0.0,113.5,144.5
IRL Publishing activities,30.0,121.8,8.6,1.4,1.2,0.1,1.9,472.6,32.6,41.9,136.2,32.6,0.1,0.1,1581.8,148.7,9.2,3.9,0.0,147.0,42.7,11.3,14.3,8.4,0.1,0.1,2.1,120.0,484.5,870.1
"IRL Motion picture, video and television programme production, sound recording and music publishing activities; programming and broadcasting activities",0.0,0.0,0.0,0.0,0.0,0.0,0.5,0.0,0.0,0.0,0.1,0.0,0.0,0.1,264.6,0.1,0.0,0.0,0.0,0.0,0.0,0.0,0.0,0.0,0.0,0.0,0.0,0.0,0.1,0.1
IRL Telecommunications,0.2,1.8,2.9,0.2,0.7,0.1,14.1,13.5,7.2,2.6,103.3,0.7,0.4,27.9,2483.5,29.1,0.7,1.1,3.2,8.5,1.2,5.2,2.1,0.2,1.8,0.4,1.9,0.3,24.0,43.5
"IRL Computer programming, consultancy and related activities; information service activities",2.9,0.3,0.9,0.0,0.1,0.4,1.1,312.1,82.3,71.0,142.7,1.0,0.1,0.1,705.0,61.5,9.4,1.3,0.1,246.6,77.2,1.2,37.8,6.0,0.4,0.2,2.3,22.6,609.6,1146.8
"IRL Financial service activities, except insurance and pension funding",2.0,0.3,1.7,0.0,6.4,46.1,2.6,64.4,191.2,15.8,504.5,2.7,0.8,0.1,528.5,90.6,27.6,6.4,0.0,113.1,2.6,2.4,15.2,0.0,0.4,1.0,0.7,29.8,51.7,1052.3
"IRL Insurance, reinsurance and pension funding, except compulsory social security",6.9,1.5,5.1,0.0,0.0,14.3,6.6,18.5,23.4,71.6,348.6,0.1,0.0,2.8,376.5,435.7,13.6,0.3,18.2,50.2,3.1,0.5,1.9,0.0,0.2,0.2,3.4,1542.5,151.6,124.6
IRL Activities auxiliary to financial services and insurance activities,0.3,0.0,2.5,0.0,0.0,0.0,0.0,3.1,5.9,0.1,50.8,0.0,0.0,0.0,401.6,41.0,0.1,0.3,0.0,0.7,0.0,0.0,1.2,0.0,0.0,0.0,0.0,0.0,1.8,81.3
IRL Real estate activities,0.0,0.0,0.0,0.0,0.0,0.0,0.0,0.0,0.0,0.0,0.0,0.0,0.0,0.0,13189.8,0.0,0.0,0.0,0.0,0.0,0.0,0.0,0.0,0.0,0.0,0.0,0.0,0.0,0.0,-0.0
IRL Legal and accounting activities; activities of head offices; management consultancy activities,0.6,0.2,1.9,0.0,0.4,0.7,59.7,6.8,8.3,4.5,9.4,0.1,0.1,2.1,191.5,6.4,0.4,2.8,0.1,9.3,1.2,1.3,3.8,0.1,0.0,0.0,0.1,34.5,14.9,33.4
IRL Architectural and engineering activities; technical testing and analysis,0.0,0.0,0.0,0.0,0.0,0.0,0.0,0.0,0.0,0.0,0.0,0.0,0.0,0.0,0.0,5.3,0.0,0.0,0.0,0.0,0.0,0.0,0.0,0.0,0.0,0.0,0.0,0.0,0.0,-0.0
IRL Scientific research and development,0.0,0.1,0.5,0.0,0.1,0.1,0.0,3.6,0.5,1.6,0.6,0.1,0.0,0.0,8.7,1.3,0.1,10.2,0.8,1.4,0.0,0.0,0.3,0.0,0.1,0.0,0.0,3.8,8.5,0.9
IRL Advertising and market research,0.0,0.0,0.0,0.0,0.0,0.0,0.0,0.0,0.0,0.0,0.1,0.0,0.0,0.0,0.0,0.0,0.0,5.3,0.0,0.1,0.0,0.0,0.0,0.0,0.0,0.0,0.0,4.8,3.0,6.1
"IRL Other professional, scientific and technical activities; veterinary activities",0.0,0.1,0.1,0.0,0.0,0.3,0.0,1.3,0.0,0.0,29.9,0.4,0.0,0.0,661.4,4.4,5.8,11.2,0.0,1.5,0.1,0.6,3.6,0.0,0.1,0.3,0.1,1.6,2.5,18.4
IRL Administrative and support service activities,1.4,2.3,3.3,0.0,2.0,5.0,2.1,15.5,41.7,26.0,59.3,1.2,0.2,0.1,380.0,16.4,3.1,4.8,0.9,28.0,0.5,0.8,36.9,0.0,0.0,0.1,0.3,596.1,39.6,31.2
IRL Public administration and defence; compulsory social security,0.0,0.0,0.0,0.0,0.0,0.0,0.2,0.2,0.0,0.0,0.0,0.0,0.0,0.0,7196.5,0.0,0.2,0.0,0.0,0.0,1.8,0.0,0.0,0.0,0.0,0.6,0.0,0.0,0.1,2.6
IRL Education,0.0,0.1,0.5,0.0,0.1,0.1,0.0,3.9,0.6,1.7,0.7,0.1,0.0,0.0,7599.0,1.4,0.2,11.1,0.9,1.6,0.0,0.0,0.3,0.0,0.1,0.0,0.0,4.2,9.2,1.0
IRL Human health and social work activities,0.0,0.0,0.0,0.0,0.0,0.0,0.0,0.0,0.0,0.0,0.0,0.0,0.0,0.0,10843.8,0.0,0.0,0.0,0.0,0.0,0.0,0.0,0.0,0.0,0.0,0.0,0.0,0.0,0.0,-0.0
IRL Other service activities,0.0,0.2,0.5,0.0,0.3,1.2,8.0,4.7,4.9,0.8,51.7,0.0,0.0,37.7,3141.0,1.7,3.4,0.2,0.0,0.2,0.1,0.1,0.0,0.0,0.0,0.3,0.2,0.5,1.3,0.4
IRL Activities of households as employers; undifferentiated goods- and services-producing activities of households for own use,0.0,0.0,0.0,0.0,0.0,0.0,0.0,0.0,0.0,0.0,0.0,0.0,0.0,0.0,391.2,0.0,0.0,0.0,0.0,0.0,0.0,0.0,0.0,0.0,0.0,0.0,0.0,0.0,0.0,-0.0
IRL Activities of extraterritorial organizations and bodies,0.0,0.0,0.0,0.0,0.0,0.0,0.0,0.0,0.0,0.0,0.0,0.0,0.0,0.0,0.0,0.0,0.0,0.0,0.0,0.0,0.0,0.0,0.0,0.0,0.0,0.0,0.0,0.0,0.0,0.0
"ITA Crop and animal production, hunting and related service activities",6.4,177.5,86.7,0.9,4.0,14.7,1.1,1231.4,111.2,378.1,217.8,27.9,0.3,0.6,8.4,24057.0,12.7,0.3,0.4,59.3,57.4,89.8,10.5,2.2,18.2,1.0,3.4,32.1,657.1,75.0
ITA Forestry and logging,0.0,1.3,0.4,0.0,0.0,5.3,0.0,6.0,0.0,0.5,2.0,0.0,0.0,0.0,0.0,354.5,0.8,0.0,0.0,1.1,0.0,0.1,0.0,0.0,0.0,0.0,0.0,48.8,2.7,0.7
ITA Fishing and aquaculture,0.0,5.5,2.3,0.0,0.0,0.0,0.0,19.1,68.2,15.0,0.7,0.4,0.0,0.4,0.0,1851.3,0.7,0.0,0.0,1.0,0.0,0.0,2.0,0.0,22.0,0.0,0.0,0.0,10.3,4.1
ITA Mining and quarrying,0.3,0.4,0.6,0.1,0.1,0.5,0.2,17.0,1.1,3.9,2.5,0.8,0.0,0.0,0.1,258.7,0.5,0.2,0.3,1.4,0.1,0.2,0.2,0.1,0.3,0.1,0.0,4.1,9.5,0.2
"ITA Manufacture of food products, beverages and tobacco products",207.9,348.9,314.2,17.9,65.0,479.5,17.4,2503.1,496.1,1758.1,1485.6,51.7,3.4,2.5,50.9,72219.8,577.3,33.3,42.2,315.3,72.3,74.1,103.8,54.7,196.0,32.3,22.5,1457.5,1942.3,1020.2
"ITA Manufacture of textiles, wearing apparel and leather products",150.2,368.1,305.7,26.6,32.6,439.8,37.2,2765.4,1026.7,3071.7,1848.9,129.8,1.7,10.1,45.8,35258.7,1837.3,359.0,115.8,390.2,153.8,406.8,210.1,112.9,2684.0,118.4,107.5,3560.2,2738.1,2235.1
"ITA Manufacture of wood and of products of wood and cork, except furniture; manufacture of articles of straw and plaiting materials",7.1,14.8,11.2,1.5,2.9,14.8,8.3,102.2,42.0,108.9,75.0,4.9,0.3,2.4,7.2,4208.9,26.3,10.2,9.9,17.3,4.6,8.9,9.4,4.2,12.4,8.7,0.7,176.1,90.4,7.2
ITA Manufacture of paper and paper products,1.5,13.7,7.7,1.5,0.8,1.4,0.7,221.4,30.9,145.9,18.8,8.1,0.1,0.2,1.2,4251.2,3.1,0.7,0.7,24.3,0.7,8.0,8.4,2.7,4.2,8.9,0.3,14.8,104.4,23.8
ITA Printing and reproduction of recorded media,0.5,2.0,1.4,0.2,0.3,0.6,0.5,26.9,5.2,19.5,5.1,1.0,0.0,0.2,0.3,726.9,1.6,0.4,0.5,3.7,0.4,1.5,1.3,0.6,1.7,1.4,0.1,7.8,16.3,0.0
ITA Manufacture of coke and refined petroleum products ,0.9,47.5,9.2,3.3,5.8,5.0,1.3,12.6,341.7,121.2,30.6,0.6,2.3,0.0,0.0,13410.8,2.1,2.9,0.0,6.9,0.2,0.7,20.5,10.5,0.5,29.4,1.3,177.7,951.6,182.4
ITA Manufacture of chemicals and chemical products ,23.5,41.3,59.9,9.6,13.0,4.1,13.6,342.0,189.9,408.4,179.0,18.2,2.2,10.5,2.5,9153.1,39.4,2.1,17.2,116.2,11.3,43.8,59.2,22.0,85.6,39.5,8.2,265.5,661.7,212.7
ITA Manufacture of basic pharmaceutical products and pharmaceutical preparations,213.5,96.9,123.1,8.9,58.3,67.9,29.3,994.6,415.8,789.9,290.0,51.5,2.2,4.2,34.0,2702.6,224.2,73.0,81.4,38.4,14.8,102.0,134.3,46.2,2.8,1.5,4.9,914.8,739.4,580.4
ITA Manufacture of rubber and plastic products,24.5,44.8,29.1,12.1,18.5,24.3,27.5,361.4,159.0,385.8,141.3,19.9,3.4,17.6,9.7,7551.8,48.1,18.2,38.7,83.1,10.5,63.3,40.8,70.7,28.6,45.3,8.0,164.8,239.1,257.5
ITA Manufacture of other non-metallic mineral products,11.1,13.0,6.8,0.6,1.9,17.6,4.2,73.0,33.3,64.3,40.4,4.4,0.9,1.8,1.7,2491.6,11.2,7.8,5.4,15.1,2.1,9.6,5.1,2.1,8.4,2.6,1.0,205.3,62.6,58.9
ITA Manufacture of basic metals,2.0,5.0,3.5,0.6,1.8,1.9,5.8,22.3,26.3,26.2,16.5,1.5,0.4,1.6,1.1,1523.4,2.2,1.2,3.5,3.4,0.9,4.2,3.2,2.0,2.7,5.2,0.6,25.2,63.1,-0.0
"ITA Manufacture of fabricated metal products, except machinery and equipment",48.3,87.6,79.6,10.8,43.1,38.4,168.3,525.8,344.3,555.8,425.2,39.5,9.1,47.9,31.2,12252.5,44.8,24.9,112.9,59.4,24.1,121.4,61.2,42.9,71.0,118.8,14.8,467.5,372.1,806.4
"ITA Manufacture of computer, electronic and optical products",48.1,119.5,52.1,14.4,81.3,32.8,171.8,724.6,293.6,462.0,325.3,30.5,4.8,51.5,16.5,7676.0,94.4,53.9,82.5,35.0,26.2,78.7,67.0,38.3,36.7,100.6,23.6,456.4,616.4,929.0
ITA Manufacture of electrical equipment,177.9,142.7,116.7,39.0,122.8,68.5,147.1,1257.3,565.9,860.3,882.1,74.5,7.8,39.0,49.3,9089.2,136.8,82.4,71.1,237.1,52.9,278.4,127.3,70.8,34.8,102.6,29.9,385.0,945.4,1080.0
ITA Manufacture of machinery and equipment n.e.c.,342.6,429.4,451.5,93.6,427.1,324.3,2109.4,2245.4,1924.0,1996.2,1306.6,308.2,114.0,453.0,58.1,28171.8,210.1,348.9,552.0,350.8,181.6,650.5,415.7,472.5,676.6,1062.8,202.7,2564.0,2650.1,5337.8
"ITA Manufacture of motor vehicles, trailers and semi-trailers",110.9,256.5,213.3,30.4,31.2,40.2,118.0,2744.7,1099.5,1839.7,1276.8,131.3,7.4,22.5,64.9,14446.0,197.0,18.6,48.9,191.2,36.2,209.2,166.8,83.7,48.6,167.4,9.8,561.5,1115.1,927.9
ITA Manufacture of other transport equipment,46.8,39.5,65.6,16.8,38.1,291.9,18.7,462.7,262.1,656.5,751.7,5.7,2.0,28.0,8.3,6795.9,73.6,4.1,11.4,73.3,86.4,22.3,92.0,4.1,12.8,42.9,4.2,325.8,595.7,1816.2
ITA Manufacture of furniture; other manufacturing,127.5,233.9,164.5,24.4,52.0,284.1,156.7,1489.7,664.0,1811.3,1364.1,78.8,3.6,41.7,133.1,16871.3,457.4,182.7,182.9,292.6,72.9,139.6,150.5,53.8,168.4,144.5,5.9,3406.9,1493.1,1001.1
ITA Repair and installation of machinery and equipment,2.3,3.9,3.3,0.7,3.1,2.9,13.1,17.6,13.4,20.4,11.3,1.9,0.7,2.9,0.6,9944.8,1.7,2.3,3.6,3.2,1.7,4.2,3.3,2.9,4.2,6.7,1.8,19.4,21.5,62.4
"ITA Electricity, gas, steam and air conditioning supply",0.0,0.8,7.1,0.0,0.0,0.1,0.1,47.4,0.5,1.1,1.0,0.1,0.0,0.0,0.1,19782.9,0.0,0.0,0.0,1.0,0.2,0.1,0.2,0.1,0.0,0.5,0.1,0.6,5.0,3.0
"ITA Water collection, treatment and supply",0.0,0.0,0.0,0.0,0.0,0.0,0.0,0.0,0.0,0.1,0.0,0.0,0.0,0.0,0.0,3921.8,0.0,0.0,0.0,0.0,0.0,0.0,0.0,0.0,0.0,0.0,0.0,0.0,0.1,-44.2
"ITA Sewerage; waste collection, treatment and disposal activities; materials recovery; remediation activities and other waste management services ",0.0,0.0,0.1,0.0,0.0,0.0,0.0,0.6,0.1,0.2,0.1,0.0,0.0,0.0,0.1,7718.7,0.0,0.0,0.0,0.2,0.0,0.0,0.0,0.0,0.0,0.0,0.0,0.1,0.4,19.5
ITA Construction,0.1,0.6,0.7,0.0,0.1,0.1,1.0,1.4,0.3,0.9,11.9,0.0,0.0,0.0,0.1,162312.0,0.0,0.1,0.1,11.5,2.5,0.6,1.0,0.4,0.5,0.1,0.0,0.7,4.7,5.4
ITA Wholesale and retail trade and repair of motor vehicles and motorcycles,1.4,3.6,3.2,0.4,0.3,0.4,0.4,42.4,15.1,26.2,18.1,1.7,0.1,0.1,1.5,27369.9,2.8,0.2,0.5,3.4,0.4,2.8,2.2,1.3,1.3,1.9,0.1,8.0,15.3,20.0
"ITA Wholesale trade, except of motor vehicles and motorcycles",20.6,37.8,66.0,2.3,10.3,21.4,18.1,290.9,123.5,254.5,120.5,10.1,1.0,5.7,58.3,52070.0,57.7,14.6,14.4,59.7,9.3,23.7,19.5,8.4,46.0,14.9,5.8,230.0,220.9,2654.7
"ITA Retail trade, except of motor vehicles and motorcycles",19.0,30.7,30.0,3.0,9.5,35.8,22.5,221.4,83.6,195.1,144.4,9.4,1.2,5.8,7.7,59085.6,66.7,15.7,13.3,31.0,10.1,21.3,18.0,9.6,63.8,16.2,5.0,223.4,200.4,297.0
ITA Land transport and transport via pipelines,0.9,29.8,36.2,0.5,0.5,3.2,3.6,111.7,36.4,36.7,36.7,0.7,0.2,0.4,1.1,24855.1,10.8,0.4,0.1,9.2,1.0,6.2,2.2,1.0,7.3,30.3,1.1,16.4,57.6,649.9
ITA Water transport,0.0,2.0,3.2,0.2,0.1,1.0,2.1,20.9,5.4,3.9,36.9,0.2,0.1,7.1,0.3,3285.4,18.4,0.6,0.0,5.2,1.0,0.8,0.7,1.1,1.3,24.2,0.2,0.6,13.1,1438.4
ITA Air transport,0.1,14.9,10.9,0.9,2.1,8.7,7.5,41.6,79.3,67.2,151.9,2.2,0.4,9.6,6.5,5814.3,72.8,0.7,3.2,14.8,5.7,1.9,6.9,3.0,1.8,8.5,1.7,74.6,62.0,173.3
ITA Warehousing and support activities for transportation,1.7,41.9,146.5,0.6,4.3,2.7,0.7,373.4,122.2,141.0,57.3,2.4,0.4,6.7,0.7,11821.0,30.6,3.5,1.5,11.1,12.1,5.4,9.9,0.9,10.0,18.2,10.1,14.6,144.8,478.9
ITA Postal and courier activities,0.0,1.2,1.6,0.0,0.1,0.1,0.1,5.1,2.2,2.3,9.4,0.1,0.0,0.0,0.1,1446.3,0.3,0.0,0.0,1.4,0.1,0.2,0.1,0.0,0.1,0.5,0.1,0.2,2.0,28.7
ITA Accommodation and food service activities,0.0,0.0,0.0,0.0,0.0,0.0,0.0,0.1,1.0,0.1,2.4,0.0,0.0,0.0,0.0,71619.7,0.0,0.0,0.0,0.1,0.0,0.0,0.0,0.0,0.0,0.0,0.0,0.1,1.0,0.1
ITA Publishing activities,4.1,1.8,7.8,0.5,0.1,0.0,0.0,101.8,9.7,21.6,21.5,0.6,0.0,0.0,0.1,7913.1,4.4,1.3,0.0,34.9,17.7,13.7,0.6,0.5,0.0,0.0,0.6,17.3,70.4,98.3
"ITA Motion picture, video and television programme production, sound recording and music publishing activities; programming and broadcasting activities",1.9,15.4,34.4,1.4,2.5,0.7,0.0,27.8,29.5,123.1,264.8,0.8,6.3,0.0,0.0,4711.3,6.8,47.7,12.6,25.1,1.2,6.0,15.7,3.2,0.0,0.0,19.8,80.9,37.4,122.9
ITA Telecommunications,4.7,40.3,48.8,6.3,7.1,7.4,9.3,139.7,111.2,81.4,568.0,7.5,1.0,8.5,3.1,17338.6,6.6,6.3,9.3,43.5,4.5,21.4,11.5,4.7,15.3,9.8,4.6,24.5,170.1,237.0
"ITA Computer programming, consultancy and related activities; information service activities",4.2,9.7,5.6,1.2,6.4,2.2,12.6,130.7,28.7,47.3,40.6,2.6,0.3,4.0,3.2,15719.2,8.3,4.2,6.4,38.5,8.2,15.5,6.1,3.8,2.4,7.3,2.2,36.1,169.7,687.9
"ITA Financial service activities, except insurance and pension funding",0.4,0.5,1.7,0.0,1.0,0.9,0.0,8.6,1.5,10.5,36.5,0.9,0.0,0.0,21.4,22855.6,0.2,5.4,0.1,8.1,0.9,2.3,0.9,0.1,0.0,0.4,0.0,0.4,20.2,403.8
"ITA Insurance, reinsurance and pension funding, except compulsory social security",0.1,7.7,3.6,0.1,0.0,0.3,3.8,225.3,13.4,32.9,36.5,0.1,0.0,0.6,60.9,16254.6,2.9,0.0,6.2,10.8,0.3,1.0,0.8,0.2,0.1,5.3,0.2,121.1,60.6,146.5
ITA Activities auxiliary to financial services and insurance activities,0.2,0.1,4.3,0.0,0.0,0.0,0.0,1.4,0.4,0.5,13.3,0.0,0.0,0.0,0.5,1578.3,0.0,0.7,0.0,0.4,0.0,0.1,0.3,0.0,0.0,0.0,0.0,1.3,2.9,31.8
ITA Real estate activities,2.4,3.0,0.4,0.0,6.9,0.1,0.0,62.9,1.4,0.4,83.6,0.0,0.0,0.0,0.0,135097.0,0.1,0.5,0.0,122.4,0.2,17.9,0.5,0.0,0.6,0.0,2.2,0.7,1.1,13.6
ITA Legal and accounting activities; activities of head offices; management consultancy activities,3.3,1.7,22.4,0.6,1.5,0.5,19.3,13.3,30.4,54.3,9.9,0.2,0.2,0.2,2.5,9966.1,0.2,0.5,0.1,50.4,3.4,24.0,1.4,1.7,0.0,0.1,0.2,21.4,42.7,65.6
ITA Architectural and engineering activities; technical testing and analysis,0.1,0.3,0.6,0.1,0.1,0.1,0.2,3.5,1.0,3.9,3.9,0.2,0.0,0.0,2.3,430.7,0.4,0.2,0.3,1.6,0.1,0.4,0.2,0.1,0.2,0.2,0.0,2.1,6.4,1.2
ITA Scientific research and development,3.6,5.9,24.0,2.9,2.9,1.9,0.5,108.5,22.0,153.1,21.6,3.3,0.0,0.1,2.9,3611.8,5.0,6.0,15.5,66.5,0.3,4.9,3.2,3.1,4.4,0.0,0.2,57.4,289.4,34.3
ITA Advertising and market research,0.0,0.0,0.3,0.3,0.0,0.0,0.2,0.4,0.8,0.7,2.3,0.0,0.0,0.0,0.0,410.7,0.0,1.4,0.0,3.6,0.1,0.3,0.0,0.0,0.0,0.0,0.0,28.8,9.0,33.4
"ITA Other professional, scientific and technical activities; veterinary activities",0.2,1.3,2.3,0.1,0.1,0.4,0.0,8.5,1.7,6.0,97.4,1.0,0.2,0.0,76.2,3967.3,6.2,2.3,0.5,10.2,1.8,5.8,2.0,0.1,0.6,1.7,0.9,6.4,17.9,6.6
ITA Administrative and support service activities,4.2,22.1,11.8,0.2,5.7,2.6,0.9,24.8,83.6,146.7,115.6,1.5,0.1,0.1,26.7,7599.6,2.2,0.6,1.2,77.1,2.1,8.7,8.4,0.9,0.5,1.4,0.5,398.7,163.2,100.4
ITA Public administration and defence; compulsory social security,0.1,0.2,0.3,0.1,0.1,0.0,0.0,2.0,0.6,2.2,0.6,0.1,0.0,0.0,0.0,129046.7,0.1,0.1,0.2,1.0,0.0,0.2,0.1,0.2,0.1,0.1,0.0,0.8,3.9,3.1
ITA Education,1.0,0.5,0.3,0.1,0.3,0.7,0.5,3.9,1.1,2.1,4.1,0.1,0.0,0.6,0.1,71039.3,0.5,0.2,0.6,0.8,0.3,0.5,0.2,0.1,0.1,0.3,0.1,5.3,4.4,20.9
ITA Human health and social work activities,0.7,1.1,1.2,0.2,0.3,1.4,0.7,9.1,3.3,11.7,10.1,0.4,0.0,0.2,0.6,109269.8,2.1,0.9,1.1,2.9,0.5,0.8,0.7,0.3,0.8,0.6,0.0,19.2,12.7,16.0
ITA Other service activities,1.8,7.1,6.6,0.5,2.4,2.8,5.0,31.9,96.7,31.1,222.8,1.2,0.5,2.7,2.5,50097.7,9.3,6.2,3.2,6.8,1.3,3.9,3.3,1.5,8.3,3.4,2.4,28.8,105.2,42.2
ITA Activities of households as employers; undifferentiated goods- and services-producing activities of households for own use,0.0,0.0,0.0,0.0,0.0,0.0,0.0,0.0,0.0,0.0,0.0,0.0,0.0,0.0,0.0,14086.1,0.0,0.0,0.0,0.0,0.0,0.0,0.0,0.0,0.0,0.0,0.0,0.0,0.0,0.0
ITA Activities of extraterritorial organizations and bodies,0.0,0.0,0.0,0.0,0.0,0.0,0.0,0.0,0.0,0.0,0.0,0.0,0.0,0.0,0.0,0.0,0.0,0.0,0.0,0.0,0.0,0.0,0.0,0.0,0.0,0.0,0.0,0.0,0.0,0.0
"JPN Crop and animal production, hunting and related service activities",1.0,0.0,0.2,0.0,0.1,2.4,6.5,0.7,0.2,0.9,0.8,0.0,0.3,0.2,0.0,0.2,26951.0,3.9,0.0,0.4,0.1,0.0,0.0,0.0,0.8,0.0,38.7,6.4,0.3,9.1
JPN Forestry and logging,0.0,0.0,0.0,0.0,0.0,0.0,0.0,0.0,0.0,0.0,0.0,0.0,0.0,0.0,0.0,0.0,2677.9,0.0,0.0,0.0,0.0,0.0,0.0,0.0,0.0,0.0,0.2,0.0,0.0,0.0
JPN Fishing and aquaculture,0.7,0.1,3.1,0.0,0.1,0.1,4.2,2.9,2.6,3.1,10.6,0.0,0.6,4.1,0.0,1.9,1086.4,72.9,0.0,0.1,0.0,0.0,0.0,0.0,36.9,0.0,4.8,0.3,0.6,13.0
JPN Mining and quarrying,1.6,0.3,0.8,0.0,0.6,1.6,12.1,40.2,0.9,2.3,3.3,0.1,0.5,0.4,0.1,1.2,-530.2,7.2,0.7,0.4,0.1,0.1,0.1,0.0,0.1,0.3,5.5,27.5,1.8,2.6
"JPN Manufacture of food products, beverages and tobacco products",40.7,1.8,5.1,0.0,5.7,31.3,170.7,8.0,5.9,12.0,12.2,0.0,17.2,1.3,0.6,2.9,193075.3,158.4,2.4,9.7,2.2,0.1,0.2,0.0,11.5,0.2,271.8,241.0,7.8,498.0
"JPN Manufacture of textiles, wearing apparel and leather products",4.0,1.0,1.6,0.0,0.5,6.6,100.8,7.0,2.6,28.5,17.2,0.4,2.2,1.3,0.2,10.5,15054.7,60.5,3.0,2.1,0.7,0.6,0.2,0.0,2.2,1.5,70.2,128.1,5.7,219.7
"JPN Manufacture of wood and of products of wood and cork, except furniture; manufacture of articles of straw and plaiting materials",0.8,0.1,0.4,0.0,0.1,0.8,1.6,3.2,0.4,1.4,1.3,0.0,0.4,0.4,0.1,0.6,215.1,2.1,0.4,0.4,0.1,0.0,0.0,0.0,0.3,0.1,0.6,13.3,0.9,1.5
JPN Manufacture of paper and paper products,0.5,0.1,0.4,0.0,0.1,1.1,14.3,2.8,0.2,0.8,0.8,0.1,0.7,0.4,0.0,0.4,3385.2,10.6,1.0,1.8,0.0,0.0,0.0,0.0,0.1,0.1,19.5,22.0,3.0,12.8
JPN Printing and reproduction of recorded media,0.2,0.0,0.1,0.0,0.1,0.2,2.0,0.7,0.1,0.3,0.3,0.0,0.2,0.1,0.0,0.2,647.0,1.1,0.2,0.1,0.0,0.0,0.0,0.0,0.0,0.1,1.3,3.2,0.2,0.0
JPN Manufacture of coke and refined petroleum products ,9.7,0.0,0.2,0.0,0.3,0.9,104.3,1.4,0.2,1.8,1.0,0.2,12.2,0.6,0.0,0.4,34701.8,96.1,0.2,1.1,0.1,0.1,0.0,0.1,1.1,0.2,48.9,49.2,0.9,48.1
JPN Manufacture of chemicals and chemical products ,19.9,1.7,7.2,0.3,9.9,5.2,240.6,72.4,14.4,40.6,30.2,1.1,26.4,43.7,1.5,24.1,18165.6,20.5,8.8,44.6,1.6,1.5,1.4,0.2,5.2,5.6,154.9,363.5,25.3,252.4
JPN Manufacture of basic pharmaceutical products and pharmaceutical preparations,15.1,2.0,1.6,0.2,8.1,4.3,42.6,69.8,38.5,77.5,4.1,1.4,2.4,1.2,42.6,47.1,729.9,52.7,21.1,4.1,0.2,2.2,4.3,0.8,0.1,0.2,9.1,1263.2,18.0,139.1
JPN Manufacture of rubber and plastic products,24.0,4.1,7.6,0.1,16.6,15.7,203.3,52.3,10.2,23.5,44.8,8.3,35.3,21.8,2.7,12.3,5413.8,90.6,128.7,26.7,1.2,5.8,2.5,1.0,1.8,7.1,85.4,218.4,16.6,298.7
JPN Manufacture of other non-metallic mineral products,3.8,0.8,1.1,0.0,1.7,5.9,17.1,12.6,1.3,3.3,6.0,1.1,1.4,2.2,0.2,11.9,2504.7,32.6,4.0,10.4,0.8,0.3,0.1,0.0,0.7,0.3,14.3,102.8,3.3,77.8
JPN Manufacture of basic metals,8.3,1.1,3.5,0.0,2.9,6.5,64.9,21.5,4.2,7.7,11.5,0.7,8.8,4.6,1.0,5.0,3959.9,28.7,5.3,3.3,0.7,0.6,0.8,0.1,1.7,2.5,38.5,117.4,7.9,0.6
"JPN Manufacture of fabricated metal products, except machinery and equipment",72.4,7.1,34.8,0.2,46.5,54.5,824.3,94.0,52.4,49.7,97.6,12.4,214.9,86.6,17.4,36.1,34511.7,209.2,110.3,23.8,7.0,6.2,14.8,0.4,11.5,36.9,538.9,1258.7,88.4,2448.2
"JPN Manufacture of computer, electronic and optical products",712.1,138.8,303.9,3.3,208.4,738.6,4799.1,2996.5,415.1,1031.7,1453.6,27.1,193.0,150.6,50.6,513.7,65957.0,3029.2,249.8,117.4,69.7,52.1,42.8,10.1,75.3,128.2,1877.9,12146.3,803.8,6979.1
JPN Manufacture of electrical equipment,230.5,64.3,151.3,1.2,168.9,192.2,2747.2,1131.1,106.4,237.4,281.1,78.5,115.2,103.1,55.1,142.8,55346.2,1399.1,239.3,156.8,10.2,24.3,7.8,1.5,16.0,59.9,2334.1,3202.6,229.5,4100.4
JPN Manufacture of machinery and equipment n.e.c.,425.5,60.2,271.1,2.9,171.9,316.2,5581.6,560.5,174.8,353.1,489.1,30.2,449.6,333.0,63.1,377.9,60750.0,2455.5,159.3,508.1,39.0,55.4,33.2,14.1,197.5,239.2,4008.3,5658.1,326.7,4798.6
"JPN Manufacture of motor vehicles, trailers and semi-trailers",5080.4,437.7,477.8,2.5,77.7,2812.4,2218.6,2436.0,929.7,1309.2,2624.9,65.5,326.3,60.7,282.5,1302.4,79983.8,183.5,602.6,379.1,336.1,72.8,155.6,2.3,1650.3,218.2,554.6,33545.1,1818.9,14084.4
JPN Manufacture of other transport equipment,93.9,10.9,75.0,0.7,88.6,302.5,81.8,414.8,54.6,305.4,528.8,5.6,22.2,70.7,10.6,192.7,9647.2,91.1,8.0,58.9,105.3,7.1,12.1,0.1,11.0,4.7,66.7,826.0,809.5,10102.8
JPN Manufacture of furniture; other manufacturing,55.5,12.6,50.9,1.1,10.9,74.1,187.9,389.7,45.1,158.2,143.0,4.0,16.6,50.4,9.5,68.8,15478.0,253.2,25.7,39.0,7.5,5.3,3.6,1.2,19.5,15.6,67.0,1324.0,98.1,666.6
JPN Repair and installation of machinery and equipment,0.0,0.0,0.0,0.0,0.0,0.0,0.0,0.0,0.0,0.0,0.0,0.0,0.0,0.0,0.0,0.0,0.0,0.0,0.0,0.0,0.0,0.0,0.0,0.0,0.0,0.0,0.0,0.0,0.0,0.0
"JPN Electricity, gas, steam and air conditioning supply",0.0,0.1,3.5,0.0,0.0,0.3,0.7,20.0,0.1,0.2,0.7,0.0,0.0,0.0,0.1,0.6,46776.6,0.0,0.0,2.2,0.1,0.0,0.0,0.0,0.0,0.0,1.2,2.8,1.4,6.8
"JPN Water collection, treatment and supply",0.0,0.0,0.0,0.0,0.0,0.0,0.0,0.0,0.0,0.0,0.0,0.0,0.0,0.0,0.0,0.0,8612.7,0.0,0.0,0.0,0.0,0.0,0.0,0.0,0.0,0.0,0.0,0.0,0.0,-412.8
"JPN Sewerage; waste collection, treatment and disposal activities; materials recovery; remediation activities and other waste management services ",0.0,0.0,0.0,0.0,0.0,0.0,0.0,0.0,0.0,0.0,0.3,0.0,0.0,0.0,0.2,0.0,1497.8,0.2,0.0,0.1,0.0,0.0,0.0,0.0,0.0,0.0,0.1,0.2,0.0,0.2
JPN Construction,0.0,0.0,0.0,0.0,0.0,0.0,0.0,0.0,0.0,0.0,0.0,0.0,0.0,0.0,0.0,0.0,510499.5,0.0,0.0,0.0,0.0,0.0,0.0,0.0,0.0,0.0,0.0,0.0,0.0,0.4
JPN Wholesale and retail trade and repair of motor vehicles and motorcycles,0.1,0.0,0.0,0.0,0.0,0.0,0.0,0.5,0.1,0.1,0.2,0.0,0.0,0.0,0.1,0.0,25133.9,0.1,0.0,0.4,0.0,0.0,0.0,0.0,0.0,0.0,0.2,3.4,0.5,5.8
"JPN Wholesale trade, except of motor vehicles and motorcycles",2.7,0.3,4.6,0.0,0.4,3.6,9.2,32.4,9.3,14.7,5.0,0.6,0.9,0.6,19.2,10.3,210451.3,14.0,0.3,64.7,0.2,0.5,0.0,0.0,1.1,0.2,35.3,23.5,9.1,18291.0
"JPN Retail trade, except of motor vehicles and motorcycles",1.4,0.1,0.6,0.0,0.2,1.3,5.5,4.1,0.8,2.0,1.4,0.0,0.5,0.4,0.9,1.0,237693.1,6.0,0.2,3.3,0.1,0.1,0.0,0.0,0.4,0.1,8.2,14.9,1.1,1015.8
JPN Land transport and transport via pipelines,23.9,4.6,33.5,0.1,7.7,38.4,88.1,107.9,17.8,39.9,84.5,0.5,33.0,6.2,2.6,35.4,84321.7,17.7,0.4,38.7,9.2,3.3,1.1,0.0,4.3,4.6,34.6,117.2,114.6,2121.1
JPN Water transport,0.2,0.3,1.1,0.0,0.1,8.5,95.5,20.9,2.8,1.4,87.0,0.0,45.3,69.6,1.2,2.2,1730.8,54.7,0.0,45.2,2.2,0.6,0.1,0.0,1.1,6.6,5.5,0.0,14.6,7133.9
JPN Air transport,0.0,2.2,10.5,0.0,7.0,44.9,199.3,34.8,38.8,40.0,214.9,0.3,86.4,56.6,16.5,68.7,11871.2,42.2,11.9,72.3,9.8,0.9,0.8,0.0,1.0,1.4,83.2,739.9,47.6,476.3
JPN Warehousing and support activities for transportation,13.5,2.4,59.2,0.0,5.8,2.7,2.5,127.8,23.9,33.9,28.7,0.1,28.2,17.2,0.0,39.8,15565.8,82.5,2.1,17.2,8.4,0.9,0.5,0.0,2.2,1.1,209.4,0.7,38.1,547.6
JPN Postal and courier activities,0.0,0.1,0.1,0.0,0.0,0.0,0.5,0.2,0.0,0.2,1.2,0.0,0.0,0.0,0.0,0.0,2037.6,0.2,0.0,0.1,0.0,0.0,0.0,0.0,0.0,0.0,0.3,0.0,0.1,33.5
JPN Accommodation and food service activities,35.6,4.4,7.5,0.0,44.0,101.3,7.2,49.9,5.2,0.2,248.3,0.8,19.9,0.2,5.9,31.8,180142.1,43.8,0.5,0.5,0.0,0.3,2.1,0.1,0.7,0.5,831.5,0.5,51.4,804.7
JPN Publishing activities,1.6,0.0,2.6,0.0,0.0,0.0,0.1,2.7,0.4,1.6,3.7,0.0,0.1,0.0,0.0,0.3,8962.4,0.8,0.0,1.4,0.0,0.0,0.0,0.0,0.0,0.0,3.2,9.6,1.4,21.8
"JPN Motion picture, video and television programme production, sound recording and music publishing activities; programming and broadcasting activities",0.1,0.5,0.1,0.0,0.0,0.1,0.0,1.6,1.3,2.2,0.9,0.1,1.0,0.0,0.1,0.8,7855.6,3.3,0.2,4.0,0.1,4.0,0.1,0.0,0.0,0.0,9.1,17.7,0.5,12.7
JPN Telecommunications,2.0,0.5,1.5,0.0,0.2,0.3,4.2,1.8,0.2,1.4,12.3,0.0,1.1,0.1,0.0,1.9,61590.8,13.5,0.2,0.7,0.6,0.7,0.1,0.3,0.7,0.9,37.5,0.6,1.7,44.9
"JPN Computer programming, consultancy and related activities; information service activities",0.2,0.0,0.0,0.0,0.0,0.4,0.2,21.4,0.3,0.3,3.5,0.0,0.0,0.0,0.6,0.1,64853.4,1.5,0.0,12.5,0.1,0.2,0.0,0.0,0.0,0.2,2.6,19.7,26.3,239.7
"JPN Financial service activities, except insurance and pension funding",4.5,0.1,0.2,0.0,2.9,2.8,2.2,7.7,0.3,4.4,122.0,0.2,2.2,0.0,24.2,0.3,24275.7,2.9,1.4,6.3,0.4,0.0,0.2,0.0,0.0,5.2,0.4,5.8,3.5,908.4
"JPN Insurance, reinsurance and pension funding, except compulsory social security",0.5,0.0,0.2,0.0,0.1,1.2,15.6,2.6,1.1,1.7,10.2,0.0,0.8,0.2,2.0,2.5,80159.1,0.7,17.2,1.0,0.3,0.0,0.5,0.0,0.0,5.7,3.7,63.7,9.9,105.8
JPN Activities auxiliary to financial services and insurance activities,0.0,0.0,0.0,0.0,0.0,0.0,0.0,0.0,0.0,0.0,0.0,0.0,0.0,0.0,0.0,0.0,0.0,0.0,0.0,0.0,0.0,0.0,0.0,0.0,0.0,0.0,0.0,0.0,0.0,0.0
JPN Real estate activities,1.2,0.0,0.0,0.0,0.1,0.0,0.0,1.4,0.0,0.0,1.0,0.0,0.0,0.0,0.0,0.2,539655.4,0.4,0.0,6.3,0.0,0.1,0.0,0.0,0.0,0.0,2.5,0.0,0.0,1.5
JPN Legal and accounting activities; activities of head offices; management consultancy activities,0.0,0.0,0.0,0.0,0.0,0.0,0.0,0.0,0.0,0.0,0.0,0.0,0.0,0.0,0.0,0.0,0.0,0.0,0.0,0.0,0.0,0.0,0.0,0.0,0.0,0.0,0.0,0.0,0.0,0.0
JPN Architectural and engineering activities; technical testing and analysis,0.0,0.0,0.0,0.0,0.0,0.0,0.0,0.0,0.0,0.0,0.0,0.0,0.0,0.0,0.0,0.0,0.0,0.0,0.0,0.0,0.0,0.0,0.0,0.0,0.0,0.0,0.0,0.0,0.0,0.0
JPN Scientific research and development,0.0,0.0,0.3,0.0,0.0,0.4,0.0,4.5,0.3,1.6,0.4,0.1,0.0,0.0,0.0,0.2,13822.4,10.8,0.3,7.5,0.0,0.0,0.0,0.0,0.0,0.0,0.4,16.8,7.8,10.1
JPN Advertising and market research,0.0,0.0,0.0,0.0,0.0,0.1,0.0,0.1,0.1,0.0,0.9,0.0,0.0,0.0,0.4,0.0,253.0,20.8,0.0,2.4,0.0,0.0,0.0,0.0,0.0,0.0,0.4,77.0,1.8,12.0
"JPN Other professional, scientific and technical activities; veterinary activities",0.1,0.1,0.7,0.0,0.0,11.3,0.0,10.5,0.4,0.2,123.0,1.6,0.1,0.1,78.1,5.2,27809.0,71.2,0.0,46.7,1.9,2.6,0.3,0.0,0.1,0.8,23.4,43.9,7.2,186.9
JPN Administrative and support service activities,4.5,0.0,0.3,0.0,0.1,1.6,0.0,1.8,2.2,3.0,2.8,0.1,0.3,0.0,0.9,0.3,4397.3,0.9,0.0,13.1,0.1,0.1,0.1,0.0,0.0,0.0,1.9,302.7,1.5,22.6
JPN Public administration and defence; compulsory social security,0.1,0.1,0.1,0.0,0.0,0.4,5.5,6.7,0.1,0.1,0.2,0.2,0.2,0.0,0.1,0.1,418636.2,6.5,0.0,0.3,112.6,0.0,0.0,0.0,0.3,3.8,0.4,14.6,1.6,58.0
