,AUT,AUS,BEL,BGR,BRA,CAN,CHN,DEU,ESP,FRA,GBR,HUN,IDN,IND,IRL,ITA,JPN,KOR,MEX,NLD,NOR,POL,PRT,ROU,RUS,TUR,TWN,USA,REU,RoW
"AUT Crop and animal production, hunting and related service activities",8142.7,0.3,14.8,0.1,0.3,9.6,66.9,16.6,11.0,6.9,28.4,0.0,26.4,82.0,1.0,5.8,62.3,10.4,5.4,5.9,1.4,0.5,0.1,0.1,5.8,2.8,10.5,52.0,3.1,423.6
AUT Forestry and logging,287.4,0.0,0.0,0.0,0.0,0.1,0.1,0.2,0.0,0.0,0.0,0.0,0.0,0.0,0.0,0.0,0.1,0.0,0.0,0.7,0.0,0.0,0.0,0.0,0.0,0.0,0.0,10.3,0.3,0.5
AUT Fishing and aquaculture,786.6,0.0,0.0,0.0,0.0,0.0,4.1,0.4,1.3,10.3,0.0,0.0,0.8,0.0,0.0,0.7,27.8,0.1,0.0,0.0,0.0,0.0,0.0,0.0,13.5,0.0,17.5,0.2,0.0,253.2
AUT Mining and quarrying,7427.2,0.0,8.4,0.0,0.6,0.2,99.9,187.6,0.7,0.6,35.5,0.2,0.3,0.2,0.1,2.9,0.2,0.1,0.0,141.5,0.2,0.0,0.0,0.1,0.0,0.0,0.1,53.9,2.8,77.9
"AUT Manufacture of food products, beverages and tobacco products",24039.8,3.9,34.5,1.7,5.2,457.2,407.3,96.4,12.7,45.2,1051.4,0.1,280.6,7.3,58.6,7.8,3104.5,738.8,56.5,97.9,16.4,3.2,0.2,2.5,92.8,1.7,241.9,1705.7,173.5,3068.3
"AUT Manufacture of textiles, wearing apparel and leather products",1092.0,0.4,1.1,0.1,0.6,11.2,6.8,5.9,1.3,2.8,37.8,0.0,3.0,1.5,1.6,2.4,13.1,8.7,0.7,2.9,1.2,2.9,0.1,0.1,3.1,0.5,2.3,69.0,6.6,271.5
"AUT Manufacture of wood and of products of wood and cork, except furniture; manufacture of articles of straw and plaiting materials",625.0,0.0,0.2,0.0,0.1,0.9,2.2,0.7,0.2,0.5,1.7,0.0,0.6,0.4,0.2,0.2,2.3,0.9,0.2,0.3,0.1,0.0,0.0,0.0,0.2,0.1,0.4,5.4,0.4,1.2
AUT Manufacture of paper and paper products,1150.5,0.0,0.0,0.0,0.1,0.4,1.0,0.6,0.1,0.1,1.1,0.0,0.3,0.3,0.1,0.1,1.3,0.4,0.1,0.2,0.0,0.1,0.3,0.0,0.2,0.0,0.2,2.3,0.4,57.9
AUT Printing and reproduction of recorded media,275.5,0.0,0.0,0.0,0.1,0.6,0.9,0.3,0.1,0.2,1.3,0.0,0.3,0.1,0.1,0.1,2.1,0.6,0.1,0.2,0.0,0.0,0.0,0.0,0.1,0.0,0.2,3.6,0.3,0.0
AUT Manufacture of coke and refined petroleum products ,6767.3,0.1,0.2,0.0,0.4,1.9,4.2,1.2,0.2,0.5,2.5,0.0,5.6,1.9,0.3,0.3,47.2,5.6,0.3,4.0,0.1,0.0,0.0,0.0,0.3,0.1,35.5,6.2,1.4,446.7
AUT Manufacture of chemicals and chemical products ,2696.1,0.2,0.9,0.1,0.9,3.4,29.5,4.8,0.9,2.5,23.5,0.1,5.8,7.2,1.6,1.1,21.5,13.0,1.1,4.8,4.6,0.2,0.1,0.0,1.0,0.6,8.3,43.6,7.7,169.1
AUT Manufacture of basic pharmaceutical products and pharmaceutical preparations,1380.4,0.7,0.6,0.1,17.3,34.0,82.0,65.8,32.1,44.9,33.3,0.1,7.6,0.7,66.6,22.1,6.3,106.0,24.2,6.3,0.6,4.1,1.5,0.3,0.2,0.0,129.9,148.7,33.5,574.4
AUT Manufacture of rubber and plastic products,1827.2,0.2,0.5,0.1,0.8,3.6,14.5,3.0,0.7,1.9,9.5,0.0,7.6,2.7,0.9,1.1,11.4,4.1,1.3,2.2,0.6,0.2,0.1,0.0,0.7,0.7,2.4,25.8,2.5,89.3
AUT Manufacture of other non-metallic mineral products,901.8,0.1,0.2,0.0,0.2,1.0,3.5,0.8,0.4,0.4,2.3,0.0,0.9,0.5,0.2,0.2,1.9,0.9,0.3,0.4,0.1,0.1,0.0,0.0,0.3,0.1,0.5,6.1,0.6,6.7
AUT Manufacture of basic metals,1103.5,0.1,0.8,0.0,0.4,138.7,8.9,1.0,0.3,1.4,2.3,0.0,2.7,1.1,0.3,0.4,4.3,1.2,1.0,2.3,0.2,0.0,0.0,0.0,0.5,0.1,0.5,11.6,0.8,0.0
"AUT Manufacture of fabricated metal products, except machinery and equipment",3587.6,0.5,10.4,0.2,1.5,8.8,24.3,7.2,1.2,12.5,17.2,0.0,13.6,7.1,1.0,1.8,19.4,6.1,13.6,1.8,1.5,0.2,0.1,0.1,2.4,0.9,2.4,96.9,4.3,175.2
"AUT Manufacture of computer, electronic and optical products",3084.6,4.7,4.4,1.1,9.9,18.7,41.0,56.0,4.9,11.6,54.1,0.6,9.3,15.8,1.5,11.6,35.9,45.3,1.9,1.2,1.9,2.1,0.7,1.5,3.9,4.2,7.8,221.2,28.7,518.0
AUT Manufacture of electrical equipment,3210.3,1.8,1.5,0.3,3.2,11.8,23.6,8.3,1.8,4.5,33.2,0.1,8.9,5.0,1.9,3.7,7.8,8.7,3.3,1.4,0.6,0.5,1.2,0.4,1.3,2.5,2.7,56.2,6.5,228.2
AUT Manufacture of machinery and equipment n.e.c.,5700.7,2.7,3.9,1.1,8.0,32.2,165.7,21.4,5.6,9.3,36.7,0.2,40.6,27.0,3.1,8.5,12.1,18.9,9.3,5.9,1.5,0.8,0.5,0.8,19.5,4.7,8.9,122.0,12.0,503.8
"AUT Manufacture of motor vehicles, trailers and semi-trailers",9873.3,0.6,0.7,0.3,16.9,3.2,69.8,10.6,1.3,2.6,41.5,0.0,26.2,3.2,1.1,1.1,7.3,62.4,1.2,3.0,0.3,0.2,0.1,0.1,2.2,1.0,1.9,88.5,9.1,2540.9
AUT Manufacture of other transport equipment,4140.4,0.1,0.3,0.0,0.4,16.4,10.0,7.5,5.4,6.5,33.2,0.0,7.2,0.7,1.5,13.9,55.3,4.2,0.6,5.8,0.4,0.0,0.2,0.0,0.7,44.3,0.4,53.2,6.2,199.3
AUT Manufacture of furniture; other manufacturing,2684.1,0.8,1.3,0.2,1.0,14.0,18.2,15.4,2.5,23.4,20.7,0.2,2.6,4.2,5.0,2.2,28.7,3.7,1.6,9.1,1.8,0.4,0.3,0.1,1.0,1.1,1.2,274.0,12.2,177.4
AUT Repair and installation of machinery and equipment,0.0,0.0,0.0,0.0,0.0,0.0,0.0,0.0,0.0,0.0,0.0,0.0,0.0,0.0,0.0,0.0,0.0,0.0,0.0,0.0,0.0,0.0,0.0,0.0,0.0,0.0,0.0,0.0,0.0,0.0
"AUT Electricity, gas, steam and air conditioning supply",11787.0,0.0,0.2,0.0,0.0,0.5,1.1,1.4,0.0,0.1,0.6,0.0,0.1,0.1,0.0,0.1,0.0,0.0,0.0,0.4,0.0,0.0,0.0,0.0,0.0,0.0,0.0,0.5,0.4,2.3
"AUT Water collection, treatment and supply",5391.9,0.0,0.0,0.0,0.0,0.0,0.2,0.0,0.0,0.0,0.0,0.0,0.0,0.0,0.0,0.0,0.0,0.0,0.0,0.0,0.0,0.0,0.0,0.0,0.0,0.0,0.0,0.0,0.0,-44.8
"AUT Sewerage; waste collection, treatment and disposal activities; materials recovery; remediation activities and other waste management services ",791.7,0.0,0.0,0.0,0.0,0.0,0.2,0.0,0.0,0.0,0.0,0.0,0.0,0.0,0.0,0.0,0.0,0.0,0.0,0.0,0.0,0.0,0.0,0.0,0.0,0.0,0.0,0.0,0.0,0.3
AUT Construction,145720.5,0.1,0.5,0.0,4.6,1.9,35.4,1.6,1.2,1.4,3.6,0.0,1.7,0.6,0.6,0.9,5.6,2.3,0.3,3.2,0.4,0.1,0.0,0.1,0.3,0.1,1.3,18.7,3.6,57.4
AUT Wholesale and retail trade and repair of motor vehicles and motorcycles,6269.7,0.0,0.0,0.0,0.0,0.0,0.1,0.2,0.0,0.0,0.1,0.0,0.0,0.0,0.0,0.0,0.0,0.0,0.0,0.0,0.0,0.0,0.0,0.0,0.0,0.0,0.0,0.4,0.1,4.1
"AUT Wholesale trade, except of motor vehicles and motorcycles",45579.8,4.6,10.6,1.2,17.0,94.6,167.6,82.1,19.0,39.1,185.4,0.7,55.3,30.8,32.2,20.0,329.3,138.4,18.2,24.4,5.1,3.7,1.4,1.5,17.6,6.5,80.4,479.8,55.2,472.5
"AUT Retail trade, except of motor vehicles and motorcycles",60687.0,0.8,2.9,0.2,3.8,32.4,42.8,17.0,4.0,9.4,67.8,0.1,18.9,5.5,8.4,3.7,156.8,47.6,5.2,8.0,1.4,0.8,0.3,0.3,6.0,1.1,22.2,147.4,15.5,127.7
AUT Land transport and transport via pipelines,14539.0,4.7,9.4,0.8,12.1,70.3,130.4,58.8,13.3,29.4,145.5,0.6,46.6,22.2,23.9,13.8,276.1,103.6,13.9,19.7,3.6,2.6,1.0,0.9,14.1,5.6,57.1,349.4,49.5,557.2
AUT Water transport,13.4,0.0,0.0,0.0,0.2,0.0,0.0,0.0,0.0,0.0,0.0,0.0,0.0,0.0,0.0,0.0,0.0,0.0,0.0,0.0,0.0,0.0,0.0,0.0,0.0,0.0,0.0,0.4,0.1,0.5
AUT Air transport,865.2,0.1,0.2,0.0,1.9,1.9,1.1,1.4,0.7,1.1,4.0,0.0,1.0,0.3,0.2,1.7,6.8,0.8,0.1,0.9,0.3,0.0,0.0,0.0,0.1,5.0,0.1,9.0,1.8,34.8
AUT Warehousing and support activities for transportation,7106.6,7.1,15.5,0.1,1.7,3.6,3.0,47.0,3.1,26.9,23.4,1.4,13.7,18.7,0.5,9.7,52.2,28.7,0.3,2.8,16.1,0.2,0.5,0.0,0.4,1.4,4.0,7.7,25.7,614.8
AUT Postal and courier activities,6.0,0.0,0.0,0.0,0.0,0.0,0.2,0.0,0.0,0.0,0.0,0.0,0.0,0.0,0.0,0.0,0.0,0.0,0.0,0.0,0.0,0.0,0.0,0.0,0.0,0.0,0.0,0.0,0.0,0.2
AUT Accommodation and food service activities,40552.1,3.0,4.7,0.0,5.1,97.7,194.8,15.9,0.4,0.0,212.9,0.4,62.1,0.0,85.2,14.9,128.7,16.1,0.0,0.2,0.0,0.0,0.3,0.0,0.0,0.0,66.5,0.4,52.2,1269.5
AUT Publishing activities,4876.5,0.5,1.5,0.0,1.3,0.0,0.9,4.3,2.5,8.0,6.1,0.0,0.9,0.0,0.0,1.4,0.5,0.3,0.0,6.3,0.4,0.1,0.2,0.1,0.0,0.0,0.4,40.1,2.6,341.6
"AUT Motion picture, video and television programme production, sound recording and music publishing activities; programming and broadcasting activities",2772.8,0.5,0.5,0.0,8.6,2.2,0.1,2.3,0.8,3.3,14.6,0.5,26.7,0.0,0.0,2.7,3.5,5.8,0.4,1.6,0.7,0.1,0.1,0.2,0.0,0.0,3.1,15.5,2.3,137.9
AUT Telecommunications,13079.9,0.3,0.9,0.0,2.0,0.7,38.7,1.3,3.5,1.0,12.5,0.1,1.7,2.5,3.2,2.9,3.6,1.6,1.5,4.4,0.1,0.2,0.1,0.2,1.1,1.9,4.6,0.8,3.3,112.7
"AUT Computer programming, consultancy and related activities; information service activities",11645.7,0.0,0.0,0.0,5.5,0.4,5.8,0.4,2.6,0.2,0.8,0.1,0.1,0.0,0.0,0.1,0.8,0.1,0.0,1.4,0.3,0.1,0.0,0.1,0.0,0.1,0.1,2.5,5.5,286.8
"AUT Financial service activities, except insurance and pension funding",26159.5,0.1,0.1,0.0,3.3,0.2,5.8,0.3,1.8,0.4,11.8,0.1,1.6,0.0,0.9,0.1,1.6,1.0,0.0,1.0,0.1,0.0,0.0,0.0,0.0,1.8,0.0,0.7,0.9,248.3
"AUT Insurance, reinsurance and pension funding, except compulsory social security",30696.7,0.1,0.2,0.0,0.4,1.4,3.0,1.3,0.3,0.8,4.0,0.1,1.2,0.6,2.6,0.4,5.9,2.1,0.4,0.8,0.1,0.1,0.0,0.0,0.3,0.2,1.2,38.5,1.5,39.2
AUT Activities auxiliary to financial services and insurance activities,2394.0,0.0,0.7,0.0,0.3,0.0,0.5,0.1,0.3,0.0,3.0,0.0,0.1,0.0,0.0,0.1,0.0,0.3,0.0,0.2,0.0,0.0,0.0,0.0,0.0,0.0,0.0,0.5,0.4,72.9
AUT Real estate activities,91124.0,0.2,0.0,0.0,12.3,0.3,0.0,10.5,0.2,0.0,15.0,0.0,25.0,0.0,0.0,4.6,0.2,1.5,0.0,26.1,0.1,0.1,0.0,0.0,0.0,0.0,3.4,0.0,0.1,98.2
AUT Legal and accounting activities; activities of head offices; management consultancy activities,19723.6,0.3,5.4,0.2,11.6,3.6,677.8,5.3,17.4,15.2,4.2,0.2,8.8,2.4,0.5,8.4,0.0,0.9,0.0,41.3,7.1,0.5,0.2,2.4,0.0,0.0,1.8,108.0,23.0,641.1
AUT Architectural and engineering activities; technical testing and analysis,0.0,0.0,0.0,0.0,0.0,0.0,0.0,0.0,0.0,0.0,0.0,0.0,0.0,0.0,0.0,0.0,0.0,0.0,0.0,0.0,0.0,0.0,0.0,0.0,0.0,0.0,0.0,0.0,0.0,0.0
AUT Scientific research and development,0.0,0.0,0.0,0.0,0.0,0.0,0.0,0.0,0.0,0.0,0.0,0.0,0.0,0.0,0.0,0.0,0.0,0.0,0.0,0.0,0.0,0.0,0.0,0.0,0.0,0.0,0.0,0.0,0.0,0.0
AUT Advertising and market research,0.0,0.0,0.0,0.0,0.0,0.0,0.0,0.0,0.0,0.0,0.0,0.0,0.0,0.0,0.0,0.0,0.0,0.0,0.0,0.0,0.0,0.0,0.0,0.0,0.0,0.0,0.0,0.0,0.0,0.0
"AUT Other professional, scientific and technical activities; veterinary activities",0.0,0.0,0.0,0.0,0.0,0.0,0.0,0.0,0.0,0.0,0.0,0.0,0.0,0.0,0.0,0.0,0.0,0.0,0.0,0.0,0.0,0.0,0.0,0.0,0.0,0.0,0.0,0.0,0.0,0.0
AUT Administrative and support service activities,4571.8,0.2,0.1,0.0,72.0,1.5,0.4,0.8,1.4,2.7,3.0,0.1,0.2,0.0,2.2,2.8,1.5,2.1,0.0,4.9,0.2,0.0,0.1,0.1,0.0,0.0,0.3,127.8,31.5,151.8
AUT Public administration and defence; compulsory social security,73571.5,0.0,0.0,0.0,0.2,0.2,7.0,1.0,0.2,0.1,0.1,0.2,5.4,0.0,0.0,0.1,8.8,0.1,0.0,0.5,7.1,0.0,0.0,0.0,0.0,6.6,0.0,1.8,0.8,35.7
AUT Education,45158.8,1.5,0.1,1.1,3.8,75.1,24.7,0.0,0.2,0.1,23.8,0.8,49.5,142.2,0.0,5.5,1.3,0.6,0.0,4.2,0.1,4.9,0.0,0.2,1.0,0.0,1.2,45.3,7.8,1163.4
AUT Human health and social work activities,68741.3,1.2,0.0,0.0,0.0,2.0,2.4,0.0,0.1,1.0,4.6,0.0,7.0,0.1,0.0,0.3,0.2,0.0,0.0,0.1,0.0,0.2,0.0,0.0,0.0,0.0,0.0,8.1,0.5,159.3
AUT Other service activities,20181.8,0.2,0.1,0.0,1.1,73.5,67.0,0.5,3.6,0.1,71.6,0.8,8.1,10.2,1.3,1.6,3.7,0.7,0.0,0.5,0.1,0.2,0.0,0.0,0.0,1.4,1.1,0.6,3.5,14.3
AUT Activities of households as employers; undifferentiated goods- and services-producing activities of households for own use,7368.0,0.0,0.0,0.0,0.1,4.5,4.1,0.0,0.2,0.0,4.6,0.1,0.5,0.6,0.0,0.1,0.2,0.0,0.0,0.0,0.0,0.0,0.0,0.0,0.0,0.1,0.0,0.0,0.2,-0.2
AUT Activities of extraterritorial organizations and bodies,0.0,0.0,0.0,0.0,0.0,0.0,0.0,0.0,0.0,0.0,0.0,0.0,0.0,0.0,0.0,0.0,0.0,0.0,0.0,0.0,0.0,0.0,0.0,0.0,0.0,0.0,0.0,0.0,0.0,0.0
"AUS Crop and animal production, hunting and related service activities",3.1,1609.3,5.2,4.1,1.6,2.2,0.4,142.1,8.6,8.3,18.2,29.4,0.1,0.2,2.0,71.7,4.2,1.8,0.6,10.1,2.2,11.6,0.6,19.2,17.6,1.2,0.1,18.9,126.3,28.8
AUS Forestry and logging,0.0,513.2,0.0,0.0,0.0,0.0,0.0,0.2,0.0,0.0,0.0,0.0,0.0,0.0,0.0,0.1,0.0,0.0,0.0,0.0,0.0,0.1,0.0,0.1,0.0,0.0,0.0,0.0,0.4,0.1
AUS Fishing and aquaculture,0.0,1.2,0.2,0.0,0.0,0.0,0.0,1.2,0.0,0.1,0.0,0.1,0.0,0.0,0.0,0.4,0.0,0.0,0.0,0.0,0.0,0.0,0.0,0.0,0.0,0.0,0.0,0.0,0.3,0.0
AUS Mining and quarrying,0.2,588.6,0.9,0.2,0.1,0.2,0.3,168.6,0.6,1.1,0.9,5.9,0.0,0.2,0.1,3.7,0.3,0.1,0.1,1.7,0.2,0.6,0.1,0.7,0.5,0.2,0.1,2.0,5.5,2.1
"AUS Manufacture of food products, beverages and tobacco products",80.5,6291.8,73.2,63.2,38.3,51.8,10.9,2046.8,145.5,153.5,264.4,188.6,2.4,2.6,23.9,931.2,107.6,46.8,15.8,175.2,16.1,97.9,16.3,177.3,129.4,21.8,2.8,470.9,1140.7,673.6
"AUS Manufacture of textiles, wearing apparel and leather products",12.6,99.1,11.4,9.1,0.7,8.9,5.6,718.1,39.7,71.5,112.9,127.5,0.1,0.7,2.0,214.3,15.4,11.4,1.5,22.2,9.7,83.6,7.9,40.5,202.5,4.8,4.2,59.0,383.0,122.2
"AUS Manufacture of wood and of products of wood and cork, except furniture; manufacture of articles of straw and plaiting materials",1.0,1852.5,0.7,0.4,0.3,1.1,1.8,33.1,2.1,5.0,4.2,2.6,0.0,0.3,0.7,10.2,1.5,0.3,0.4,2.3,0.8,2.0,0.3,2.3,1.6,0.6,0.1,5.8,17.1,0.7
AUS Manufacture of paper and paper products,0.2,245.3,1.1,2.1,0.2,0.3,0.6,69.4,2.3,6.5,4.8,13.3,0.0,0.1,0.4,5.6,0.2,0.1,0.1,4.9,0.6,5.0,0.3,9.6,4.2,0.9,0.3,1.8,35.0,7.1
AUS Printing and reproduction of recorded media,0.3,168.8,1.5,0.6,0.1,0.0,0.3,18.2,0.3,1.6,1.1,1.3,0.0,0.0,0.0,1.2,0.1,0.2,0.0,0.5,0.2,2.7,0.2,1.2,0.1,0.1,0.1,2.2,8.2,-0.0
AUS Manufacture of coke and refined petroleum products ,1.2,2465.4,2.4,13.5,4.1,0.7,2.6,62.6,3.3,10.6,3.6,131.5,0.2,0.6,0.7,13.4,0.8,0.8,0.7,5.3,0.6,8.8,0.6,55.7,4.3,2.6,0.6,9.4,246.2,35.5
AUS Manufacture of chemicals and chemical products ,2.9,480.1,10.8,10.9,5.3,0.8,6.2,202.6,6.8,18.1,7.3,25.1,0.4,0.8,0.7,49.7,1.1,2.9,1.9,28.1,1.6,31.0,1.6,40.3,12.8,7.3,0.3,20.1,212.4,46.0
AUS Manufacture of basic pharmaceutical products and pharmaceutical preparations,27.8,417.3,3.4,16.9,25.9,7.2,22.0,482.9,46.9,115.2,11.1,27.8,2.1,0.8,5.8,76.9,1.6,8.2,19.9,4.3,2.4,43.1,13.7,85.0,3.2,0.8,0.4,231.9,254.7,259.2
AUS Manufacture of rubber and plastic products,5.9,437.4,4.7,4.4,3.5,11.8,13.1,281.5,12.6,41.3,31.6,25.4,0.6,2.3,5.0,54.7,8.7,3.5,4.8,21.0,13.4,13.8,5.6,27.4,6.5,6.9,3.9,26.5,107.5,48.1
AUS Manufacture of other non-metallic mineral products,2.0,1102.9,0.9,0.6,0.6,3.1,3.3,65.2,3.4,6.2,5.7,5.7,0.1,0.6,0.8,15.5,4.5,0.6,0.6,2.4,1.1,2.3,0.6,2.5,2.4,0.6,0.2,16.6,35.1,8.6
AUS Manufacture of basic metals,2.4,710.2,3.0,1.8,1.5,12.9,7.4,63.7,5.8,10.0,6.3,6.0,0.6,1.7,2.5,14.6,1.8,1.7,2.3,5.6,1.8,6.3,1.0,8.0,6.3,3.1,0.9,16.0,45.9,0.0
"AUS Manufacture of fabricated metal products, except machinery and equipment",27.2,2227.8,27.8,8.1,8.0,25.6,33.4,642.9,58.1,111.8,68.7,40.5,3.9,8.1,13.1,154.0,15.9,9.4,36.1,26.8,21.7,62.6,7.2,27.8,35.6,23.5,5.4,239.3,269.6,161.5
"AUS Manufacture of computer, electronic and optical products",14.3,549.6,36.9,26.2,20.8,11.0,95.2,427.0,49.4,87.9,74.0,52.3,1.1,35.0,1.5,122.7,47.0,36.1,3.8,11.2,15.7,48.2,32.3,213.6,30.5,47.1,5.1,157.3,668.3,271.8
AUS Manufacture of electrical equipment,83.4,1983.1,39.0,21.4,17.5,32.6,102.8,1290.8,118.4,150.6,155.2,56.6,29.0,33.6,15.4,161.6,46.5,24.2,12.0,50.4,48.5,51.4,19.6,52.1,30.5,46.1,13.0,207.4,651.3,654.1
AUS Manufacture of machinery and equipment n.e.c.,87.4,1614.9,107.9,108.8,113.1,76.1,750.6,2312.8,409.1,441.8,269.6,310.5,46.7,136.9,25.6,569.0,64.0,121.8,93.3,122.4,94.7,248.5,35.6,440.9,731.1,189.7,105.9,582.3,1677.1,1595.2
"AUS Manufacture of motor vehicles, trailers and semi-trailers",170.5,781.8,42.8,36.6,23.4,158.0,215.7,3171.7,642.7,293.7,682.1,151.7,5.1,20.3,29.9,724.4,69.6,71.4,20.2,129.2,64.8,120.9,11.0,123.5,224.7,64.5,7.1,2830.2,835.3,881.1
AUS Manufacture of other transport equipment,28.4,46.0,7.6,2.3,1.8,110.6,7.8,680.3,38.6,111.7,95.3,4.5,0.6,2.4,3.8,67.1,42.2,26.3,7.4,28.4,115.7,18.5,38.7,6.7,0.7,2.4,38.0,106.1,329.1,185.3
AUS Manufacture of furniture; other manufacturing,26.7,2708.8,17.7,10.2,4.1,54.5,31.6,941.2,80.2,179.1,172.5,60.8,0.8,6.9,22.5,294.7,66.0,11.4,7.5,50.6,28.3,63.4,8.8,35.3,55.8,13.0,0.8,217.5,538.3,279.9
AUS Repair and installation of machinery and equipment,1.1,1061.1,2.9,2.5,2.3,0.9,7.7,81.6,4.3,28.7,4.2,8.3,0.4,2.0,0.2,11.4,1.9,1.8,0.7,12.4,12.6,3.2,6.9,19.0,5.5,2.7,6.0,10.4,47.6,46.2
"AUS Electricity, gas, steam and air conditioning supply",0.1,4299.0,11.0,0.2,0.1,0.3,3.4,171.3,0.7,1.5,1.0,6.5,0.0,0.1,0.3,11.2,0.0,0.1,0.0,6.0,0.4,1.6,0.2,1.1,0.1,0.6,0.1,1.4,18.3,27.6
"AUS Water collection, treatment and supply",0.0,36.1,0.1,0.0,0.0,0.0,0.1,0.9,0.1,0.1,0.1,0.1,0.0,0.0,0.0,0.3,0.0,0.0,0.0,0.1,0.0,0.1,0.0,0.0,0.0,0.0,0.0,0.0,0.5,-36.7
"AUS Sewerage; waste collection, treatment and disposal activities; materials recovery; remediation activities and other waste management services ",0.1,165.2,0.2,0.1,0.1,0.1,0.8,2.9,0.4,0.5,0.3,0.3,0.0,0.1,0.1,0.8,0.1,0.1,0.0,0.4,0.1,0.4,0.1,0.4,0.4,0.2,0.1,0.8,13.0,37.3
AUS Construction,0.8,33825.7,1.1,0.5,0.4,1.3,6.4,26.0,2.0,4.0,7.0,12.9,0.2,1.1,0.3,5.7,0.6,0.4,0.4,20.5,1.3,15.5,0.8,8.7,6.4,0.8,0.5,4.1,21.9,75.2
AUS Wholesale and retail trade and repair of motor vehicles and motorcycles,2.1,6017.0,1.5,1.7,1.4,1.3,6.1,60.5,5.6,8.4,5.8,6.9,0.3,1.2,0.7,12.2,1.3,1.7,1.2,2.6,1.0,4.7,0.9,8.0,5.7,1.4,0.4,18.5,36.2,25.2
"AUS Wholesale trade, except of motor vehicles and motorcycles",29.5,12147.1,24.0,25.0,21.7,18.4,78.4,799.6,80.2,132.3,80.0,105.6,4.6,14.0,14.5,204.8,20.5,21.9,17.4,44.6,17.0,68.8,15.2,117.2,79.2,21.5,8.1,249.8,527.7,1240.7
"AUS Retail trade, except of motor vehicles and motorcycles",1.2,21402.9,2.0,1.0,0.7,1.2,6.2,39.1,3.5,4.9,5.4,4.4,0.2,0.7,1.8,10.0,1.0,0.7,0.6,3.2,0.8,3.6,0.5,4.9,2.8,0.8,0.3,9.2,29.6,46.6
AUS Land transport and transport via pipelines,4.2,5745.9,42.2,7.2,1.3,7.5,17.8,368.9,25.3,32.6,22.5,31.8,0.5,0.9,1.4,105.5,4.2,1.4,0.9,16.2,1.2,58.9,1.7,9.6,21.1,30.8,0.8,18.8,271.1,830.2
AUS Water transport,0.0,10.7,0.1,0.1,0.0,0.1,0.2,2.6,0.1,0.2,0.6,0.3,0.0,0.8,0.0,0.4,0.2,0.0,0.0,0.3,0.0,0.2,0.0,0.3,0.2,0.6,0.0,0.4,1.3,39.0
AUS Air transport,0.0,1777.7,4.1,6.5,0.3,4.3,3.7,43.8,11.3,16.4,20.1,25.1,0.2,29.4,1.4,95.5,7.6,0.3,0.6,7.2,0.8,3.1,0.9,2.4,1.1,2.3,0.3,11.6,64.4,56.4
AUS Warehousing and support activities for transportation,1.5,1749.4,31.8,1.6,0.8,1.0,4.3,252.9,11.5,22.6,6.6,15.3,0.2,5.6,0.3,87.4,2.4,1.8,0.5,4.5,1.3,7.8,1.1,3.7,5.6,3.3,0.4,6.7,73.4,97.0
AUS Postal and courier activities,0.0,332.2,1.0,0.6,0.0,0.2,0.6,20.6,3.2,2.3,15.2,1.5,0.0,0.0,0.6,9.7,0.0,0.0,0.0,3.2,0.6,0.5,0.2,0.2,0.0,0.1,0.1,0.0,17.3,120.1
AUS Accommodation and food service activities,2.5,19663.6,39.7,2.9,1.3,17.6,4.4,357.4,4.0,1.1,79.0,24.3,0.2,0.4,52.6,47.0,7.6,0.7,0.1,1.6,0.2,1.1,1.2,14.1,0.9,0.2,1.4,2.7,336.9,126.6
AUS Publishing activities,2.2,786.8,11.4,4.5,0.2,0.0,0.5,131.4,1.8,10.6,7.5,8.4,0.1,0.0,0.0,6.8,0.2,0.3,0.0,2.2,1.2,20.0,1.2,6.6,0.0,0.0,0.4,15.3,52.3,114.1
"AUS Motion picture, video and television programme production, sound recording and music publishing activities; programming and broadcasting activities",0.9,917.6,1.9,0.4,0.5,0.2,0.1,103.5,0.8,5.1,2.0,0.5,1.3,0.0,0.1,8.9,0.2,6.7,2.2,1.2,0.2,2.0,0.5,4.3,0.0,0.0,4.4,2.3,12.2,32.5
AUS Telecommunications,0.9,3615.5,5.1,4.1,0.1,0.5,2.4,64.9,7.9,4.8,22.9,7.4,0.7,1.6,0.9,171.5,0.3,0.2,0.8,10.9,4.3,3.9,1.0,4.0,7.7,3.0,1.1,0.4,78.9,33.2
"AUS Computer programming, consultancy and related activities; information service activities",0.9,4486.8,0.5,1.3,0.1,0.7,1.2,47.0,3.5,1.8,6.7,5.7,0.0,0.2,0.1,8.7,0.3,0.3,0.1,6.2,1.0,5.4,0.4,9.6,0.4,0.1,0.1,2.7,77.3,252.5
"AUS Financial service activities, except insurance and pension funding",1.2,3527.9,0.8,0.4,1.6,13.9,0.8,86.2,14.2,8.2,28.7,17.0,3.5,0.0,16.8,26.6,0.5,3.4,0.0,30.3,10.8,28.3,1.4,4.8,2.8,41.4,0.4,1.9,211.2,854.1
"AUS Insurance, reinsurance and pension funding, except compulsory social security",0.1,5242.1,2.5,0.7,0.1,0.5,1.4,68.4,1.1,2.6,24.6,9.6,0.1,0.7,1.4,84.2,0.9,0.2,1.8,0.6,0.1,9.8,0.6,1.3,0.2,0.5,0.0,13.6,60.4,54.0
AUS Activities auxiliary to financial services and insurance activities,0.0,344.0,0.2,0.0,0.0,0.0,0.9,1.0,0.2,0.1,0.2,0.1,0.0,0.0,0.0,1.1,0.0,0.0,0.0,0.4,0.1,0.4,0.0,0.2,0.0,0.0,0.0,0.1,1.9,7.0
AUS Real estate activities,0.2,28860.9,0.1,0.1,0.2,0.1,0.4,26.8,0.3,0.2,2.4,0.2,0.6,0.3,0.1,7.4,0.0,0.5,0.0,10.9,0.1,3.1,0.1,0.2,0.1,0.0,0.1,0.8,2.2,6.0
AUS Legal and accounting activities; activities of head offices; management consultancy activities,1.7,1069.5,6.2,3.6,0.5,0.7,84.3,29.0,8.7,8.2,1.8,2.2,0.4,0.8,0.2,23.7,0.1,0.9,0.2,30.1,4.4,21.5,0.7,15.5,0.3,0.2,0.1,8.9,51.9,61.5
AUS Architectural and engineering activities; technical testing and analysis,2.0,3702.3,2.3,2.2,1.9,1.3,14.0,50.1,7.4,8.4,5.7,5.8,0.9,29.2,0.5,13.0,1.5,3.1,1.5,3.3,1.7,4.7,0.8,8.6,11.3,3.4,1.6,11.3,38.9,61.2
AUS Scientific research and development,0.1,90.4,2.0,4.9,0.2,0.4,10.8,78.6,1.3,7.8,1.2,7.1,0.0,0.0,0.2,9.8,0.1,19.9,0.1,14.5,0.1,1.2,0.2,7.6,1.3,0.0,0.0,4.8,98.4,6.2
AUS Advertising and market research,0.0,80.1,0.1,1.6,0.0,0.0,0.4,1.4,0.1,0.1,0.3,0.1,0.0,0.0,0.0,0.3,0.0,0.7,0.0,1.0,0.0,0.2,0.0,0.3,0.0,0.0,0.0,6.4,3.8,24.7
"AUS Other professional, scientific and technical activities; veterinary activities",0.0,366.5,0.1,0.1,0.0,0.1,0.2,3.5,0.1,0.2,3.1,1.9,0.0,0.2,3.2,2.9,0.2,0.8,0.0,1.1,0.4,1.7,0.2,0.2,0.2,1.0,0.0,0.6,4.0,6.2
AUS Administrative and support service activities,0.8,4632.0,1.3,0.6,0.9,0.9,2.5,24.2,5.5,8.1,5.9,5.2,0.1,0.2,1.2,10.2,0.2,1.0,0.8,13.8,0.9,2.7,1.1,3.6,0.6,0.4,0.1,41.3,39.7,39.9
AUS Public administration and defence; compulsory social security,0.0,25304.4,0.3,0.2,0.0,0.1,1.1,9.1,0.2,0.4,0.4,1.4,0.8,0.1,0.1,1.0,1.2,0.2,0.0,0.6,63.9,0.3,0.0,0.3,0.3,23.5,0.0,0.7,5.8,-65.3
AUS Education,0.1,20387.0,1.0,2.0,0.1,0.3,4.3,34.1,0.5,3.2,1.0,3.1,0.0,1.4,0.3,4.2,0.1,8.3,0.0,6.0,0.0,0.6,0.1,3.2,0.5,0.0,0.0,1.9,42.6,8.7
AUS Human health and social work activities,0.7,30419.8,0.4,0.2,0.2,0.7,0.7,8.5,0.7,1.6,4.7,1.1,0.1,0.2,0.3,2.0,0.2,0.2,0.2,0.3,0.2,1.4,0.1,1.2,0.7,0.2,0.1,2.5,6.7,52.9
AUS Other service activities,0.2,12083.2,1.0,0.2,0.4,2.5,2.2,88.5,16.7,1.4,17.5,0.6,0.1,9.8,1.1,9.4,0.9,2.0,0.0,1.7,0.1,2.4,0.1,1.8,0.2,1.9,2.5,0.9,28.7,13.8
AUS Activities of households as employers; undifferentiated goods- and services-producing activities of households for own use,0.0,226.8,0.0,0.0,0.0,0.0,0.0,0.0,0.0,0.0,0.0,0.0,0.0,0.0,0.0,0.0,0.0,0.0,0.0,0.0,0.0,0.0,0.0,0.0,0.0,0.0,0.0,0.0,0.0,-0.0
AUS Activities of extraterritorial organizations and bodies,0.0,0.0,0.0,0.0,0.0,0.0,0.0,0.0,0.0,0.0,0.0,0.0,0.0,0.0,0.0,0.0,0.0,0.0,0.0,0.0,0.0,0.0,0.0,0.0,0.0,0.0,0.0,0.0,0.0,0.0
"BEL Crop and animal production, hunting and related service activities",0.4,19.5,1740.4,0.6,0.2,3.5,0.4,484.8,110.0,597.3,184.9,6.4,0.1,0.2,15.4,68.6,3.8,0.5,0.2,282.1,42.0,30.8,14.1,3.4,108.7,0.9,0.1,6.9,291.9,68.1
BEL Forestry and logging,0.0,0.0,16.8,0.0,0.0,0.0,0.0,0.1,0.1,1.4,0.2,0.0,0.0,0.0,0.0,0.1,0.0,0.0,0.0,1.9,0.0,0.0,0.0,0.0,0.0,0.0,0.0,0.5,0.8,0.0
BEL Fishing and aquaculture,0.0,0.1,8.7,0.0,0.0,0.0,0.0,2.7,1.1,7.3,0.2,0.0,0.0,0.0,0.0,1.0,0.0,0.0,0.0,5.2,0.0,0.0,0.2,0.0,0.1,0.0,0.0,0.0,1.5,53.4
BEL Mining and quarrying,0.3,0.0,8.5,0.0,0.0,1.1,11.5,23.8,0.1,0.7,0.3,0.5,0.0,7.8,0.0,0.1,0.0,0.0,0.0,13.8,0.0,0.1,0.0,0.0,0.1,0.0,0.0,4.3,0.3,242.7
"BEL Manufacture of food products, beverages and tobacco products",85.7,166.6,6715.3,26.1,42.2,180.6,40.6,3288.6,573.4,4370.9,2361.8,77.7,21.2,3.7,172.6,821.8,186.8,96.8,36.8,2845.2,71.5,165.8,150.9,101.8,199.5,12.9,22.8,251.4,1856.3,1060.5
"BEL Manufacture of textiles, wearing apparel and leather products",11.5,38.1,189.5,4.0,3.6,13.3,8.0,588.1,426.3,1076.7,972.8,28.4,1.7,3.4,42.2,603.2,33.7,4.6,3.4,406.5,18.3,116.6,88.5,8.5,105.8,31.5,1.4,74.1,428.2,252.2
"BEL Manufacture of wood and of products of wood and cork, except furniture; manufacture of articles of straw and plaiting materials",0.6,0.8,294.2,0.0,0.1,0.5,0.7,12.6,3.3,26.9,4.9,0.2,0.0,1.3,0.8,5.1,0.8,0.1,0.2,16.1,0.4,0.5,0.9,0.1,0.3,0.4,0.0,9.4,7.2,1.1
BEL Manufacture of paper and paper products,17.3,2.2,607.3,0.2,0.1,0.5,1.0,79.2,28.9,137.3,69.6,1.4,0.1,0.3,1.2,21.5,0.5,0.2,0.5,84.5,0.8,3.2,2.2,0.5,3.2,1.8,0.4,2.0,58.0,20.0
BEL Printing and reproduction of recorded media,1.6,0.3,415.0,0.0,0.0,0.1,0.2,8.4,2.7,13.4,6.3,0.1,0.0,0.1,0.2,2.3,0.1,0.0,0.1,8.4,0.1,0.3,0.2,0.1,0.3,0.2,0.1,0.5,6.0,0.0
BEL Manufacture of coke and refined petroleum products ,5.4,21.8,6396.8,4.2,11.2,101.3,9.9,879.8,87.9,503.5,265.5,5.3,0.9,4.5,2.7,65.9,5.7,3.1,6.2,1361.2,41.1,25.6,21.3,13.6,17.8,17.6,2.8,557.2,946.8,993.2
BEL Manufacture of chemicals and chemical products ,19.9,22.9,872.9,6.7,7.9,7.1,42.2,350.5,101.4,585.4,246.2,8.7,3.3,13.8,7.8,118.5,22.3,12.4,10.9,765.9,10.1,36.3,19.1,9.7,47.0,35.0,3.8,135.1,457.3,138.1
BEL Manufacture of basic pharmaceutical products and pharmaceutical preparations,107.0,23.0,373.4,23.0,40.2,114.2,57.2,1535.3,205.6,837.0,155.9,40.2,3.0,2.2,98.0,594.8,35.0,33.2,38.6,104.5,26.0,70.1,88.8,72.4,2.9,2.3,16.4,670.9,732.6,928.7
BEL Manufacture of rubber and plastic products,14.0,16.7,233.4,1.9,3.1,5.1,13.6,239.9,59.9,265.2,182.1,8.5,1.0,7.1,12.1,84.4,10.9,1.7,6.5,261.5,10.7,22.5,12.5,6.4,26.9,15.8,1.7,48.4,155.6,72.3
BEL Manufacture of other non-metallic mineral products,1.9,2.0,817.2,0.2,0.3,2.7,9.5,36.6,7.9,74.5,14.7,0.7,0.1,8.1,1.5,11.0,2.3,0.3,0.3,47.1,0.8,1.4,2.2,1.0,1.7,1.1,0.1,12.4,17.1,21.9
BEL Manufacture of basic metals,5.0,8.2,1025.2,1.8,3.1,31.7,28.7,105.7,32.7,93.3,59.1,3.6,1.5,10.1,10.1,46.8,2.7,2.7,3.5,106.1,6.5,11.7,7.0,5.1,15.1,11.1,0.7,26.1,82.0,0.0
"BEL Manufacture of fabricated metal products, except machinery and equipment",22.9,28.6,1797.1,5.6,9.4,13.9,62.5,355.4,141.6,480.2,282.6,12.3,9.4,26.8,22.7,182.3,18.2,10.0,16.6,414.8,26.8,61.1,34.1,17.5,51.3,35.1,2.9,150.0,299.2,294.9
"BEL Manufacture of computer, electronic and optical products",12.1,35.5,299.1,8.0,8.6,7.4,25.1,419.2,133.8,386.8,208.2,6.9,0.9,14.6,17.6,232.9,20.0,9.8,3.2,79.5,15.8,32.2,25.0,28.5,26.9,25.4,2.3,143.5,277.8,624.0
BEL Manufacture of electrical equipment,11.8,17.5,240.9,3.8,5.5,3.3,23.4,243.6,77.3,222.0,167.5,6.4,1.1,6.2,15.4,95.4,15.5,8.2,3.4,106.8,11.7,20.7,15.1,13.0,14.6,15.8,1.9,53.2,165.8,339.0
BEL Manufacture of machinery and equipment n.e.c.,48.0,97.1,1088.3,23.3,43.4,36.7,338.3,854.8,360.4,661.0,525.5,40.0,12.6,78.3,31.2,570.5,11.5,30.8,35.7,428.0,83.1,111.6,69.4,69.7,203.8,150.0,9.2,204.2,746.2,1142.0
"BEL Manufacture of motor vehicles, trailers and semi-trailers",201.6,218.6,147.3,20.2,7.8,70.5,42.1,3450.4,992.5,1530.7,3611.9,145.7,0.6,11.5,148.9,1013.9,88.2,13.4,38.0,1935.5,116.9,274.6,171.5,58.3,746.5,153.5,6.1,616.1,2068.2,1391.7
BEL Manufacture of other transport equipment,2.2,23.1,66.6,1.1,0.8,4.4,5.1,232.3,48.3,155.6,160.2,2.1,0.1,0.5,2.9,58.8,0.8,1.3,2.9,79.6,2.4,8.6,13.6,1.5,5.9,2.0,0.4,6.6,70.7,85.4
BEL Manufacture of furniture; other manufacturing,12.9,19.5,218.1,2.0,2.2,17.1,23.0,235.7,87.5,489.3,190.6,6.7,0.3,48.1,16.6,167.2,27.7,2.5,7.6,236.7,8.6,17.7,14.2,5.6,11.3,15.0,0.8,356.3,192.6,342.9
BEL Repair and installation of machinery and equipment,0.3,1.4,841.2,0.0,0.1,0.5,0.7,7.5,2.3,20.6,5.1,0.2,0.0,1.5,0.5,5.0,0.8,0.1,0.2,9.7,3.3,0.4,0.9,0.1,0.1,0.4,0.9,11.7,8.3,5.2
