,AUT,AUS,BEL,BGR,BRA,CAN,CHN,DEU,ESP,FRA,GBR,HUN,IDN,IND,IRL,ITA,JPN,KOR,MEX,NLD,NOR,POL,PRT,ROU,RUS,TUR,TWN,USA,REU,RoW
POL Architectural and engineering activities; technical testing and analysis,0.0,0.6,0.1,0.0,0.0,0.0,0.0,6.0,0.1,0.6,1.1,0.1,0.0,0.0,0.0,3.0,0.0,0.0,0.0,0.6,0.2,2198.3,0.1,0.1,0.4,0.0,0.0,0.2,1.5,0.3
POL Scientific research and development,0.0,0.8,1.0,0.3,0.0,0.2,0.1,19.3,1.0,3.2,1.5,0.8,0.0,0.0,0.1,2.2,0.0,0.2,0.0,5.0,0.1,396.9,0.2,0.5,1.0,0.1,0.0,3.0,18.8,3.9
POL Advertising and market research,0.0,0.1,0.1,0.1,0.0,0.0,0.0,1.2,0.2,0.2,0.4,0.0,0.0,0.0,0.0,0.1,0.0,0.1,0.0,1.8,0.0,73.6,0.0,0.1,0.0,0.0,0.0,4.6,2.5,14.4
"POL Other professional, scientific and technical activities; veterinary activities",0.1,1.1,1.0,0.2,0.1,0.6,0.1,17.4,0.8,2.6,14.4,1.6,0.0,0.0,14.1,4.0,0.6,0.3,0.0,8.4,1.7,852.4,0.6,0.4,0.3,0.3,0.0,2.2,11.6,13.1
POL Administrative and support service activities,0.0,0.7,0.2,0.1,0.0,0.2,0.0,4.5,1.1,0.8,2.1,0.4,0.0,0.0,0.1,2.1,0.0,0.0,0.0,1.7,0.2,1639.5,0.1,0.5,1.3,0.0,0.0,2.8,4.9,7.4
POL Public administration and defence; compulsory social security,0.0,0.0,0.0,0.0,0.0,0.0,0.0,0.3,0.0,0.0,0.0,0.0,0.0,0.0,0.0,0.0,0.0,0.0,0.0,0.6,0.0,16183.3,0.0,0.0,0.0,0.0,0.0,0.0,0.1,1.9
POL Education,0.0,0.1,0.1,0.0,0.0,0.0,0.0,1.2,0.1,0.1,0.1,0.0,0.0,0.0,0.0,0.1,0.0,0.0,0.0,0.8,0.0,12552.8,0.0,0.0,0.1,0.0,0.0,0.2,1.1,2.3
POL Human health and social work activities,0.0,0.1,0.0,0.0,0.0,0.0,0.0,1.4,0.0,0.1,0.6,0.1,0.0,0.0,0.3,0.2,0.0,0.0,0.0,0.6,0.0,11020.9,0.0,0.1,0.1,0.0,0.0,0.1,0.6,17.6
POL Other service activities,0.1,1.6,1.7,0.3,0.0,8.3,0.1,22.8,12.5,4.4,18.0,0.7,0.0,0.2,0.4,3.1,0.2,0.1,0.0,4.3,0.5,4717.8,0.2,0.3,1.4,0.2,0.0,2.9,14.8,15.3
POL Activities of households as employers; undifferentiated goods- and services-producing activities of households for own use,0.0,0.0,0.0,0.0,0.0,0.0,0.0,0.0,0.0,0.0,0.0,0.0,0.0,0.0,0.0,0.0,0.0,0.0,0.0,0.0,0.0,344.4,0.0,0.0,0.0,0.0,0.0,0.0,0.0,-0.0
POL Activities of extraterritorial organizations and bodies,0.0,0.0,0.0,0.0,0.0,0.0,0.0,0.0,0.0,0.0,0.0,0.0,0.0,0.0,0.0,0.0,0.0,0.0,0.0,0.0,0.0,0.0,0.0,0.0,0.0,0.0,0.0,0.0,0.0,0.0
"PRT Crop and animal production, hunting and related service activities",0.1,0.1,2.3,0.0,5.1,1.6,0.1,4.1,44.6,22.1,38.3,0.0,0.0,0.0,2.8,35.1,0.7,0.0,0.0,7.0,1.9,0.5,2348.5,0.0,0.4,0.0,0.0,1.5,4.3,13.1
PRT Forestry and logging,0.0,0.0,0.1,0.0,0.0,0.0,0.0,0.1,0.1,0.1,0.0,0.0,0.0,0.0,0.0,0.1,0.0,0.0,0.0,0.3,0.1,0.0,134.9,0.0,0.0,0.0,0.1,0.2,0.0,0.0
PRT Fishing and aquaculture,0.0,0.0,0.0,0.0,0.0,0.1,0.0,0.1,31.1,3.4,0.0,0.0,0.0,0.0,0.0,2.7,0.0,0.0,0.0,0.0,0.0,0.0,393.0,0.0,0.0,0.0,0.0,0.6,0.3,2.7
PRT Mining and quarrying,0.0,0.0,0.1,0.0,0.0,0.0,0.3,16.7,0.3,0.5,0.6,0.0,0.0,0.0,0.1,0.2,0.0,0.0,0.0,0.1,0.0,0.0,30.9,0.0,0.0,0.0,0.0,0.4,0.4,0.0
"PRT Manufacture of food products, beverages and tobacco products",2.3,3.9,35.2,0.0,59.7,39.5,1.9,34.3,200.2,137.6,126.9,0.3,0.3,0.0,6.1,51.3,11.6,0.7,0.8,54.1,6.7,0.4,8202.3,0.7,1.4,0.2,0.3,33.1,51.7,154.5
"PRT Manufacture of textiles, wearing apparel and leather products",7.1,43.3,52.7,0.1,2.5,36.0,0.4,549.5,676.5,729.0,713.6,1.6,0.0,0.5,24.2,166.4,17.8,2.2,17.5,135.2,53.7,14.9,4859.9,1.7,8.6,3.0,0.5,290.1,302.4,126.1
"PRT Manufacture of wood and of products of wood and cork, except furniture; manufacture of articles of straw and plaiting materials",2.1,0.1,1.0,0.0,0.0,0.1,0.0,2.3,1.7,3.0,1.2,0.0,0.0,0.0,0.1,0.6,0.0,0.0,0.0,1.0,0.1,0.1,74.8,0.1,0.0,0.0,0.0,0.7,1.1,0.5
PRT Manufacture of paper and paper products,0.0,0.0,0.1,0.0,0.0,0.0,0.0,1.6,22.4,2.5,1.1,0.0,0.0,0.0,0.7,0.2,0.0,0.0,0.0,0.3,0.1,0.0,689.0,0.0,0.0,0.3,0.0,0.0,0.9,3.3
PRT Printing and reproduction of recorded media,0.0,0.1,0.1,0.0,0.0,0.0,0.0,0.5,1.2,1.1,0.5,0.0,0.0,0.0,0.1,0.2,0.0,0.0,0.0,0.1,0.0,0.0,59.3,0.0,0.0,0.0,0.0,0.2,0.3,-0.0
PRT Manufacture of coke and refined petroleum products ,0.0,0.0,0.3,0.0,2.0,0.1,0.0,1.5,4.8,2.3,10.3,0.0,0.0,0.0,0.0,1.6,0.0,0.0,0.0,0.6,0.0,0.0,1742.1,0.0,0.1,1.1,0.0,39.0,0.7,14.8
PRT Manufacture of chemicals and chemical products ,0.1,0.1,1.9,0.1,0.1,0.1,0.0,7.6,24.5,12.9,16.7,0.3,0.0,0.1,0.2,4.9,0.0,0.0,0.1,2.5,0.1,1.3,592.5,1.1,2.4,0.1,0.0,1.9,7.1,11.3
PRT Manufacture of basic pharmaceutical products and pharmaceutical preparations,0.4,0.7,0.6,0.0,0.6,0.2,0.7,10.4,6.6,8.2,8.3,0.1,0.0,0.0,0.3,1.2,1.4,0.3,0.6,0.4,0.4,2.6,485.7,0.1,0.0,0.0,0.0,7.3,7.1,21.2
PRT Manufacture of rubber and plastic products,0.6,2.5,10.5,0.1,0.9,0.4,0.4,24.9,39.0,60.0,7.6,1.0,0.0,2.0,0.4,6.1,0.2,0.1,0.6,5.9,1.2,1.8,109.6,0.9,0.1,0.7,0.1,2.0,6.9,18.3
PRT Manufacture of other non-metallic mineral products,1.5,1.1,4.4,0.0,0.3,3.4,0.1,33.9,20.0,49.6,47.4,0.1,0.0,0.1,1.8,7.0,0.6,0.3,5.7,9.4,3.7,1.3,311.4,0.0,1.2,0.2,0.0,49.8,19.4,7.3
PRT Manufacture of basic metals,0.0,0.0,0.1,0.0,0.0,0.0,0.0,0.5,1.0,0.4,0.2,0.0,0.0,0.0,0.0,0.1,0.0,0.0,0.1,0.1,0.0,0.1,43.3,0.0,0.0,0.0,0.0,0.4,0.2,0.0
"PRT Manufacture of fabricated metal products, except machinery and equipment",1.2,1.0,15.0,0.1,2.0,2.7,3.4,50.7,108.4,79.7,34.0,4.1,0.2,3.8,3.5,7.0,2.0,0.1,9.4,6.4,4.6,14.2,441.9,6.4,1.0,4.3,2.3,68.3,29.2,111.5
"PRT Manufacture of computer, electronic and optical products",0.8,1.4,37.1,0.0,1.3,0.8,6.3,323.2,109.9,29.1,49.3,1.7,0.0,0.3,0.8,77.6,3.3,0.6,0.8,2.2,0.9,3.8,928.0,0.6,0.1,3.1,0.5,42.2,6.5,56.9
PRT Manufacture of electrical equipment,2.3,1.4,4.2,0.3,3.1,1.6,4.0,59.2,57.5,36.6,15.5,3.1,0.1,0.2,1.4,31.4,2.5,1.5,3.4,6.5,0.7,13.4,532.4,1.6,0.0,1.9,1.6,29.1,13.5,57.9
PRT Manufacture of machinery and equipment n.e.c.,3.1,1.2,11.7,0.4,3.3,1.0,1.9,114.2,96.7,26.2,18.9,1.3,0.3,1.5,3.3,21.0,0.7,3.2,4.2,6.1,1.6,5.2,670.0,6.8,0.7,3.1,1.2,42.8,12.9,74.0
"PRT Manufacture of motor vehicles, trailers and semi-trailers",1.1,89.7,217.1,0.3,0.8,0.6,2.5,627.4,282.6,211.3,376.5,6.8,0.0,0.1,11.0,140.9,1.8,0.1,2.5,41.8,9.9,18.3,2389.1,0.5,4.9,4.2,0.1,5.2,28.8,188.7
PRT Manufacture of other transport equipment,0.1,0.5,1.8,0.2,0.1,1.4,0.0,3.8,33.2,28.4,11.8,0.1,0.1,0.1,0.4,3.3,0.2,0.1,0.0,1.8,0.9,1.6,82.1,0.0,0.0,0.0,0.4,0.6,16.7,23.2
PRT Manufacture of furniture; other manufacturing,0.3,3.6,4.6,0.0,0.5,1.0,0.1,22.9,62.9,77.1,26.9,0.7,0.0,0.2,1.4,7.0,0.9,0.6,0.1,5.7,1.7,1.4,1481.2,0.1,0.4,0.2,0.1,8.0,16.8,26.4
PRT Repair and installation of machinery and equipment,0.0,1.5,1.2,0.0,0.7,0.3,0.1,3.9,7.1,21.0,2.4,0.1,0.0,0.1,0.3,2.4,0.1,0.0,0.2,1.3,2.4,0.4,545.8,0.1,0.0,0.1,9.7,1.5,7.1,4.4
"PRT Electricity, gas, steam and air conditioning supply",0.0,0.0,0.7,0.0,0.0,0.0,0.0,2.3,0.3,0.2,0.2,0.0,0.0,0.0,0.0,0.3,0.0,0.0,0.0,0.1,0.0,0.0,2313.1,0.0,0.0,0.0,0.0,0.1,0.4,0.1
"PRT Water collection, treatment and supply",0.0,0.0,0.0,0.0,0.0,0.0,0.0,0.0,0.0,0.0,0.0,0.0,0.0,0.0,0.0,0.0,0.0,0.0,0.0,0.0,0.0,0.0,473.5,0.0,0.0,0.0,0.0,0.0,0.0,-11.2
"PRT Sewerage; waste collection, treatment and disposal activities; materials recovery; remediation activities and other waste management services ",0.0,0.0,0.0,0.0,0.0,0.0,0.0,0.1,0.1,0.0,0.0,0.0,0.0,0.0,0.0,0.1,0.0,0.0,0.0,0.0,0.0,0.0,469.4,0.0,0.0,0.0,0.0,0.0,0.0,0.2
PRT Construction,0.1,0.2,1.6,0.0,0.0,0.3,0.1,2.3,2.5,2.9,12.4,0.1,0.0,0.0,0.3,2.2,0.1,0.0,0.3,1.3,0.8,0.7,20125.2,0.1,0.1,0.1,0.0,2.6,1.7,23.2
PRT Wholesale and retail trade and repair of motor vehicles and motorcycles,0.0,0.0,0.1,0.0,0.0,0.0,0.0,0.3,0.8,0.7,0.4,0.0,0.0,0.0,0.0,0.1,0.0,0.0,0.0,0.1,0.0,0.0,3665.9,0.0,0.0,0.0,0.0,0.1,0.4,0.6
"PRT Wholesale trade, except of motor vehicles and motorcycles",0.6,2.5,10.9,0.0,3.1,2.4,1.0,49.7,70.3,47.3,27.9,0.4,0.0,0.1,33.7,59.6,2.7,0.3,0.9,12.1,2.4,2.5,2259.3,0.2,0.3,0.4,5.1,15.6,21.1,1082.9
"PRT Retail trade, except of motor vehicles and motorcycles",0.2,0.7,3.1,0.1,2.8,2.6,0.1,8.5,31.4,24.1,17.2,0.1,0.1,0.1,1.6,5.3,0.7,0.1,0.2,4.1,1.0,0.8,8846.3,0.1,0.1,0.1,0.3,6.1,12.4,27.8
PRT Land transport and transport via pipelines,0.1,2.7,8.8,0.0,0.3,0.3,0.1,15.0,18.9,14.8,13.4,0.0,0.1,0.0,1.4,9.1,0.0,0.0,0.0,2.2,0.0,0.2,1634.2,0.0,0.2,0.1,0.1,1.8,13.1,82.9
PRT Water transport,0.0,0.0,0.0,0.0,0.0,0.0,0.0,0.4,0.4,0.1,3.1,0.0,0.0,0.0,0.1,0.1,0.0,0.0,0.0,0.3,0.0,0.0,133.4,0.0,0.0,0.0,0.0,0.0,0.3,34.3
PRT Air transport,0.0,2.8,6.5,0.0,7.0,1.6,0.4,13.0,99.2,71.9,119.1,0.1,0.4,0.0,20.6,57.1,0.3,0.0,0.1,8.1,1.1,0.1,670.4,0.1,0.1,0.0,1.3,36.8,15.5,40.1
PRT Warehousing and support activities for transportation,0.1,1.2,14.7,0.0,2.4,0.0,0.0,19.2,25.1,24.5,6.2,0.0,0.1,0.0,0.0,13.5,0.0,0.0,0.0,0.8,0.3,0.0,990.6,0.0,0.1,0.0,0.7,0.0,2.8,15.6
PRT Postal and courier activities,0.0,0.0,0.1,0.0,0.0,0.0,0.0,0.2,0.9,0.3,0.9,0.0,0.0,0.0,0.0,0.1,0.0,0.0,0.0,0.2,0.0,0.0,119.4,0.0,0.0,0.0,0.0,0.0,0.1,5.9
PRT Accommodation and food service activities,0.2,1.4,6.0,0.0,2.7,2.3,0.0,14.4,5.4,0.2,55.1,0.0,0.1,0.0,67.6,2.7,0.2,0.0,0.0,0.1,0.0,0.0,10826.2,0.0,0.0,0.0,0.3,0.1,17.7,13.2
PRT Publishing activities,0.1,0.8,0.2,0.0,0.0,0.0,0.0,0.5,0.3,0.7,0.2,0.0,0.0,0.0,0.1,1.1,0.0,0.0,0.0,0.5,0.0,0.2,981.6,0.0,0.0,0.0,0.1,0.1,0.8,6.6
"PRT Motion picture, video and television programme production, sound recording and music publishing activities; programming and broadcasting activities",0.2,0.3,2.2,0.1,0.1,0.1,0.0,1.4,4.8,4.4,6.9,0.0,4.2,0.0,0.1,1.4,0.1,0.1,0.5,2.5,0.0,0.1,453.5,0.2,0.0,0.0,2.3,6.5,1.3,14.5
PRT Telecommunications,0.1,1.1,3.2,0.0,0.7,0.1,0.0,5.3,35.4,8.0,25.2,0.1,1.0,0.0,0.4,5.1,0.2,0.0,0.6,3.0,0.2,0.1,3585.1,0.0,0.3,0.1,2.2,0.2,6.7,22.2
"PRT Computer programming, consultancy and related activities; information service activities",0.0,0.0,0.2,0.0,0.0,0.2,0.0,2.2,1.2,0.3,0.4,0.0,0.0,0.0,0.1,0.7,0.3,0.0,0.0,0.2,0.1,0.0,1007.7,0.0,0.0,0.0,0.1,0.3,0.5,9.1
"PRT Financial service activities, except insurance and pension funding",0.0,0.0,0.1,0.0,0.0,0.2,0.0,0.1,9.3,0.4,1.6,0.0,0.3,0.0,0.9,0.2,0.1,0.0,0.0,2.6,0.0,0.2,3312.0,0.0,0.0,0.0,0.0,0.0,0.7,23.3
"PRT Insurance, reinsurance and pension funding, except compulsory social security",0.0,0.1,0.1,0.0,0.0,0.0,0.0,0.1,1.3,0.8,0.7,0.0,0.0,0.0,0.9,0.3,0.0,0.0,0.0,0.0,0.0,0.0,2546.3,0.0,0.0,0.0,0.0,3.2,0.8,1.2
PRT Activities auxiliary to financial services and insurance activities,0.0,0.0,0.6,0.0,0.0,0.0,0.0,0.0,2.1,0.0,1.2,0.0,0.0,0.0,0.0,0.6,0.0,0.0,0.0,0.1,0.0,0.0,114.0,0.0,0.0,0.0,0.0,0.0,0.1,11.9
PRT Real estate activities,0.0,0.0,0.0,0.0,0.0,0.0,0.0,0.1,0.1,0.0,0.3,0.0,0.0,0.0,0.0,0.3,0.0,0.0,0.0,0.3,0.0,0.0,12585.8,0.0,0.0,0.0,0.0,0.0,0.0,0.4
PRT Legal and accounting activities; activities of head offices; management consultancy activities,0.4,0.0,2.1,0.0,0.1,0.2,0.2,0.6,12.1,3.3,0.4,0.0,0.5,0.0,0.1,5.3,0.0,0.0,0.0,3.1,0.4,0.3,1062.3,0.0,0.0,0.0,0.1,1.0,3.4,8.4
PRT Architectural and engineering activities; technical testing and analysis,0.0,0.0,0.1,0.0,0.0,0.0,0.0,0.3,0.3,0.1,0.1,0.0,0.0,0.0,0.1,6.3,0.0,0.0,0.0,0.0,0.0,0.0,306.6,0.0,0.0,0.0,0.0,0.1,0.1,0.2
PRT Scientific research and development,0.0,0.0,0.0,0.0,0.0,0.0,0.0,0.1,0.1,0.1,0.0,0.0,0.0,0.0,0.0,0.1,0.0,0.0,0.0,0.1,0.0,0.0,387.3,0.0,0.0,0.0,0.0,0.0,0.5,0.1
PRT Advertising and market research,0.0,0.0,0.2,0.0,0.0,0.0,0.0,0.2,0.6,0.5,0.8,0.0,0.4,0.0,0.0,0.2,0.0,0.0,0.0,0.3,0.0,0.0,51.6,0.0,0.0,0.0,0.3,1.2,0.3,5.3
"PRT Other professional, scientific and technical activities; veterinary activities",0.0,0.0,0.1,0.0,0.0,0.2,0.0,0.3,0.1,0.0,7.7,0.0,0.0,0.0,19.5,3.7,0.3,0.0,0.0,0.8,0.2,0.1,148.2,0.0,0.0,0.0,0.1,0.2,0.4,2.7
PRT Administrative and support service activities,0.0,0.0,0.1,0.0,0.0,0.1,0.0,0.2,6.2,1.2,1.7,0.0,0.0,0.0,0.4,0.8,0.0,0.0,0.0,0.5,0.0,0.0,507.0,0.0,0.0,0.0,0.0,2.7,0.3,1.5
PRT Public administration and defence; compulsory social security,0.0,0.0,0.4,0.0,0.1,0.0,0.0,0.5,1.8,0.7,0.8,0.0,0.0,0.0,0.7,1.2,0.0,0.0,0.0,0.3,0.1,0.0,14920.4,0.0,0.0,0.0,0.0,0.3,0.5,1.7
PRT Education,0.0,0.0,0.1,0.0,0.0,0.0,0.0,0.2,0.3,0.3,0.2,0.0,0.0,0.0,0.1,0.3,0.0,0.0,0.0,0.2,0.0,0.0,11372.9,0.0,0.0,0.0,0.0,0.1,1.1,0.6
PRT Human health and social work activities,0.0,0.0,0.0,0.0,0.0,0.0,0.0,0.1,0.2,0.1,0.4,0.0,0.0,0.0,0.2,0.1,0.0,0.0,0.0,0.0,0.0,0.0,12588.7,0.0,0.0,0.0,0.0,0.1,0.1,1.2
PRT Other service activities,0.0,0.0,0.2,0.0,0.0,0.1,0.0,0.2,14.4,0.2,5.0,0.0,0.0,0.0,0.1,0.2,0.0,0.0,0.0,0.2,0.0,0.0,4054.6,0.0,0.0,0.0,0.1,0.1,2.4,0.0
PRT Activities of households as employers; undifferentiated goods- and services-producing activities of households for own use,0.0,0.0,0.0,0.0,0.0,0.0,0.0,0.0,0.0,0.0,0.0,0.0,0.0,0.0,0.0,0.0,0.0,0.0,0.0,0.0,0.0,0.0,992.3,0.0,0.0,0.0,0.0,0.0,0.0,0.2
PRT Activities of extraterritorial organizations and bodies,0.0,0.0,0.0,0.0,0.0,0.0,0.0,0.0,0.0,0.0,0.0,0.0,0.0,0.0,0.0,0.0,0.0,0.0,0.0,0.0,0.0,0.0,0.0,0.0,0.0,0.0,0.0,0.0,0.0,0.0
"ROU Crop and animal production, hunting and related service activities",0.1,5.2,0.9,1.0,0.0,0.2,0.3,34.5,2.2,7.0,4.2,4.8,0.0,0.3,0.2,26.7,0.8,0.0,0.0,2.4,0.4,0.6,4.7,4372.0,0.8,3.5,0.0,3.9,18.9,12.6
ROU Forestry and logging,0.0,0.1,0.0,0.0,0.0,0.0,0.0,0.5,0.0,0.1,0.1,0.1,0.0,0.0,0.0,0.2,0.0,0.0,0.0,0.1,0.1,0.0,0.0,255.1,0.0,0.0,0.0,0.0,0.1,0.0
ROU Fishing and aquaculture,0.0,0.0,0.0,0.0,0.0,0.0,0.0,0.1,0.0,0.8,0.0,0.0,0.0,0.0,0.0,0.0,0.0,0.0,0.0,0.0,0.0,0.0,0.0,8.5,0.0,0.0,0.0,0.0,0.0,0.0
ROU Mining and quarrying,0.0,0.2,0.1,0.0,0.0,0.0,0.2,3.2,0.0,0.4,0.2,0.1,0.0,0.0,0.0,0.5,0.0,0.0,0.0,0.2,0.0,0.1,0.0,314.7,0.0,0.2,0.0,0.3,0.5,0.0
"ROU Manufacture of food products, beverages and tobacco products",0.4,9.9,2.1,7.7,0.0,1.4,0.3,20.0,0.3,3.1,4.6,8.7,0.0,0.0,0.3,15.6,0.8,0.1,0.0,4.4,0.1,3.0,0.4,7306.7,2.1,0.6,0.0,4.3,17.8,60.5
"ROU Manufacture of textiles, wearing apparel and leather products",0.9,40.5,39.0,0.5,0.1,10.5,0.2,460.1,20.7,211.3,269.8,46.9,0.0,0.0,5.6,1070.7,4.8,0.7,0.6,31.3,9.0,7.6,1.3,1150.0,4.2,1.7,0.0,50.2,40.5,36.8
"ROU Manufacture of wood and of products of wood and cork, except furniture; manufacture of articles of straw and plaiting materials",0.0,0.9,0.7,0.0,0.0,0.3,0.0,4.6,0.1,2.8,1.9,0.5,0.0,0.0,0.2,2.7,0.1,0.0,0.0,0.7,0.2,0.2,0.0,103.9,0.0,0.1,0.0,0.9,1.3,0.1
ROU Manufacture of paper and paper products,0.0,0.1,0.0,0.1,0.0,0.0,0.1,0.4,0.0,0.7,0.1,0.1,0.0,0.0,0.0,0.7,0.0,0.0,0.0,0.1,0.0,0.2,0.0,153.9,0.0,0.1,0.0,0.1,0.2,2.1
ROU Printing and reproduction of recorded media,0.0,0.0,0.0,0.0,0.0,0.0,0.0,0.0,0.0,0.0,0.0,0.0,0.0,0.0,0.0,0.1,0.0,0.0,0.0,0.0,0.0,0.0,0.0,-98.6,0.0,0.0,0.0,0.0,0.0,-0.0
ROU Manufacture of coke and refined petroleum products ,0.0,0.3,0.3,38.6,0.0,0.0,0.0,0.8,9.2,3.8,2.6,7.6,0.0,0.0,0.0,18.4,0.0,0.0,0.0,0.2,0.0,0.2,0.0,319.3,0.1,19.1,0.0,25.4,113.0,32.4
ROU Manufacture of chemicals and chemical products ,0.0,0.5,0.1,9.5,0.1,0.0,0.1,8.1,0.4,3.1,0.5,3.4,0.0,0.7,0.1,2.6,0.2,0.0,0.2,1.2,0.0,6.2,0.0,670.4,1.6,0.6,0.0,0.5,2.9,15.6
ROU Manufacture of basic pharmaceutical products and pharmaceutical preparations,0.0,0.1,0.0,1.4,0.0,0.0,0.0,1.3,0.0,0.7,0.3,0.2,0.0,0.0,0.0,1.2,0.0,0.0,0.1,0.1,0.0,0.4,0.0,255.1,0.0,0.0,0.0,0.2,0.1,2.7
ROU Manufacture of rubber and plastic products,0.0,1.0,0.5,0.5,0.0,0.0,0.0,7.7,0.8,5.0,0.8,2.0,0.0,0.0,0.0,17.6,0.0,0.0,0.1,1.3,0.1,0.2,0.1,205.6,0.0,0.2,0.0,0.3,1.9,3.2
ROU Manufacture of other non-metallic mineral products,0.2,2.7,2.5,0.5,0.0,2.3,0.1,31.1,4.2,18.7,12.3,1.7,0.0,0.0,0.0,12.1,0.2,0.0,0.0,10.9,0.6,0.5,0.0,-49.4,0.2,0.5,0.0,14.2,14.8,2.6
ROU Manufacture of basic metals,0.0,0.1,0.1,0.2,0.0,0.0,0.0,0.8,0.1,0.3,0.3,0.2,0.0,0.0,0.0,0.9,0.0,0.0,0.0,0.1,0.0,0.2,0.0,267.2,0.0,0.1,0.0,0.3,0.5,-0.0
"ROU Manufacture of fabricated metal products, except machinery and equipment",0.1,2.0,1.5,0.4,0.0,0.2,0.7,15.9,1.6,10.1,5.3,1.3,0.0,0.0,0.2,18.1,0.1,0.1,0.0,2.4,0.4,1.3,0.1,225.2,0.1,1.1,0.1,6.6,5.6,8.8
"ROU Manufacture of computer, electronic and optical products",0.4,1.4,50.6,0.5,0.0,1.3,50.7,44.8,1.0,33.4,9.5,2.4,0.0,0.1,0.4,21.9,0.3,2.0,0.2,4.2,1.3,0.5,0.1,158.1,0.2,1.2,0.1,23.7,26.1,134.1
ROU Manufacture of electrical equipment,0.2,8.4,3.5,3.5,0.6,1.9,3.6,53.9,7.1,32.6,15.7,12.6,0.0,0.1,0.3,170.7,0.8,0.8,0.0,4.9,0.3,9.5,0.2,-169.7,0.4,7.5,0.1,9.2,43.9,20.3
ROU Manufacture of machinery and equipment n.e.c.,0.3,5.6,10.7,2.8,0.6,1.8,2.2,27.1,3.0,9.9,9.9,10.3,0.1,1.3,0.4,51.3,0.5,0.4,0.5,6.9,1.1,4.6,0.1,486.8,1.2,4.2,1.1,22.7,16.8,42.4
"ROU Manufacture of motor vehicles, trailers and semi-trailers",0.1,0.5,11.0,0.5,0.0,0.3,11.4,10.9,0.3,7.0,2.2,0.8,0.0,0.0,0.1,7.7,0.1,0.4,0.0,1.0,0.3,1.0,0.0,840.0,0.1,3.9,0.0,6.1,7.4,33.5
ROU Manufacture of other transport equipment,0.1,18.0,2.1,0.2,0.0,0.5,0.0,181.9,0.2,15.7,20.7,0.6,0.1,0.1,0.5,9.4,0.2,0.0,0.0,53.4,27.8,5.0,0.0,75.3,0.2,1.7,0.0,3.1,8.6,47.7
ROU Manufacture of furniture; other manufacturing,1.0,31.1,7.6,1.2,0.1,15.8,0.2,124.7,4.6,178.4,42.5,15.2,0.0,0.0,14.9,85.4,7.6,1.1,0.9,52.6,10.1,4.5,0.1,381.5,3.1,0.2,0.0,70.0,37.1,21.3
ROU Repair and installation of machinery and equipment,0.0,2.4,0.1,0.0,0.0,0.0,0.0,1.7,0.0,0.5,0.3,0.1,0.0,0.0,0.0,0.7,0.0,0.0,0.0,0.4,0.3,0.1,0.0,158.5,0.0,0.0,0.1,0.2,0.3,0.1
"ROU Electricity, gas, steam and air conditioning supply",0.0,0.8,2.8,0.5,0.0,0.1,2.3,9.6,0.4,2.4,1.1,0.7,0.0,0.0,0.0,7.6,0.0,0.1,0.0,0.4,0.1,0.4,0.0,1647.6,0.0,0.6,0.0,1.7,4.2,8.2
"ROU Water collection, treatment and supply",0.0,0.0,0.0,0.0,0.0,0.0,0.0,0.1,0.0,0.1,0.0,0.0,0.0,0.0,0.0,0.3,0.0,0.0,0.0,0.0,0.0,0.0,0.0,250.4,0.0,0.0,0.0,0.0,0.1,0.1
"ROU Sewerage; waste collection, treatment and disposal activities; materials recovery; remediation activities and other waste management services ",0.0,0.0,0.0,0.0,0.0,0.0,0.0,0.0,0.0,0.0,0.0,0.0,0.0,0.0,0.0,0.0,0.0,0.0,0.0,0.0,0.0,0.0,0.0,116.0,0.0,0.0,0.0,0.0,0.0,0.0
ROU Construction,0.0,0.5,0.5,0.1,0.0,0.1,0.4,3.3,0.2,0.9,2.0,0.3,0.0,0.0,0.1,2.8,0.0,0.0,0.0,1.1,0.4,0.2,0.1,5626.3,0.1,0.2,0.0,0.6,1.5,8.7
ROU Wholesale and retail trade and repair of motor vehicles and motorcycles,0.0,0.2,0.0,0.0,0.0,0.0,0.0,0.4,0.0,0.1,0.1,0.0,0.0,0.0,0.0,0.3,0.0,0.0,0.0,0.0,0.0,0.0,0.0,251.5,0.0,0.1,0.0,0.0,0.1,0.2
"ROU Wholesale trade, except of motor vehicles and motorcycles",0.0,3.3,1.6,0.7,0.0,0.4,0.3,15.1,1.4,6.6,6.7,1.5,0.0,0.1,2.0,32.0,0.3,0.0,0.0,1.5,0.3,0.6,0.1,882.4,0.2,0.5,0.0,2.0,3.6,31.1
"ROU Retail trade, except of motor vehicles and motorcycles",0.0,1.4,0.6,0.1,0.0,0.1,0.0,4.3,0.5,1.6,1.8,0.3,0.0,0.0,0.1,6.0,0.1,0.0,0.0,0.4,0.1,0.1,0.0,541.0,0.0,0.5,0.0,0.5,1.2,13.4
ROU Land transport and transport via pipelines,0.1,53.2,7.3,1.0,0.0,1.2,0.6,52.6,8.2,10.8,12.4,0.7,0.1,0.0,0.3,39.9,0.3,0.1,0.0,3.1,0.1,4.1,0.1,3035.8,0.8,28.8,0.0,2.7,28.6,177.7
ROU Water transport,0.0,0.0,0.0,0.0,0.0,0.0,0.0,0.2,0.0,0.0,0.2,0.0,0.0,0.0,0.0,0.1,0.0,0.0,0.0,0.0,0.0,0.0,0.0,19.5,0.0,0.4,0.0,0.0,0.1,8.0
ROU Air transport,0.0,2.8,0.3,0.2,0.0,0.3,0.1,2.3,2.2,2.6,5.5,0.2,0.0,0.3,0.2,12.6,0.2,0.0,0.0,0.6,0.1,0.1,0.0,23.4,0.0,0.8,0.0,2.8,2.8,5.5
ROU Warehousing and support activities for transportation,0.0,6.5,2.8,0.1,0.0,0.1,0.3,15.3,2.7,4.3,2.7,0.3,0.0,0.3,0.1,15.0,0.1,0.1,0.0,0.4,0.2,0.3,0.0,173.7,0.1,2.1,0.0,0.7,4.4,22.4
ROU Postal and courier activities,0.0,0.1,0.0,0.0,0.0,0.0,0.0,0.2,0.1,0.1,0.2,0.0,0.0,0.0,0.0,0.2,0.0,0.0,0.0,0.0,0.0,0.0,0.0,21.9,0.0,0.0,0.0,0.0,0.1,0.5
ROU Accommodation and food service activities,0.3,8.1,14.2,0.5,0.1,1.4,0.1,25.6,0.8,0.2,15.8,4.3,0.0,0.0,3.0,109.7,1.6,0.0,0.0,0.1,0.0,0.0,0.3,627.1,0.1,0.0,0.1,0.1,9.4,4.4
ROU Publishing activities,0.0,0.0,0.1,0.0,0.0,0.0,0.0,0.1,0.0,0.0,0.0,0.0,0.0,0.0,0.0,0.0,0.0,0.0,0.0,0.0,0.0,0.0,0.0,109.3,0.0,0.0,0.0,0.0,0.2,0.0
"ROU Motion picture, video and television programme production, sound recording and music publishing activities; programming and broadcasting activities",0.0,0.1,0.7,0.0,0.0,0.0,0.0,1.0,0.2,0.1,2.3,0.0,0.0,0.1,0.0,0.1,0.0,0.0,0.1,0.2,0.0,0.1,0.0,40.6,0.0,0.0,0.0,1.4,0.6,0.0
ROU Telecommunications,0.2,3.8,1.2,0.6,0.0,0.1,0.1,7.8,9.6,0.7,9.9,3.0,0.0,0.3,0.0,32.7,1.1,0.0,0.1,1.9,0.4,0.2,0.8,1582.6,0.3,0.3,0.0,1.1,5.4,24.8
"ROU Computer programming, consultancy and related activities; information service activities",0.0,0.0,0.1,0.0,0.0,0.1,0.1,1.1,0.2,0.1,0.3,0.0,0.0,0.0,0.0,0.4,0.0,0.0,0.0,0.1,0.1,0.0,0.0,422.0,0.0,0.0,0.0,0.4,2.1,2.3
"ROU Financial service activities, except insurance and pension funding",0.0,0.3,0.0,0.0,0.0,0.0,0.0,1.7,0.6,0.1,0.2,0.0,0.0,0.0,0.1,1.6,0.0,0.0,0.0,0.7,0.1,0.1,0.0,136.0,0.0,0.2,0.0,0.2,1.1,4.2
"ROU Insurance, reinsurance and pension funding, except compulsory social security",0.3,1.8,0.3,0.3,0.0,0.0,0.0,5.1,0.6,1.0,1.1,0.0,0.0,0.3,0.3,13.9,0.0,0.1,0.0,0.0,0.1,0.2,0.0,96.7,0.0,2.4,0.0,4.2,11.2,11.4
ROU Activities auxiliary to financial services and insurance activities,0.2,1.4,0.2,0.2,0.0,0.0,0.0,3.9,0.5,0.7,0.8,0.0,0.0,0.2,0.2,10.5,0.0,0.0,0.0,0.0,0.1,0.1,0.0,96.6,0.0,1.8,0.0,3.2,8.5,7.2
ROU Real estate activities,0.0,0.1,0.1,0.0,0.0,0.0,0.0,0.4,0.1,0.1,0.4,0.1,0.0,0.0,0.0,1.1,0.0,0.0,0.0,0.1,0.0,0.1,0.0,5646.6,0.0,0.1,0.0,0.2,0.3,0.1
ROU Legal and accounting activities; activities of head offices; management consultancy activities,0.1,0.4,0.3,0.1,0.0,0.0,0.4,0.7,0.5,0.4,0.0,0.0,0.0,0.0,0.0,2.0,0.0,0.0,0.0,0.4,0.2,0.3,0.0,54.7,0.0,0.0,0.0,0.9,1.4,3.6
ROU Architectural and engineering activities; technical testing and analysis,0.0,0.0,0.0,0.0,0.0,0.0,0.0,0.1,0.0,0.1,0.1,0.0,0.0,0.0,0.0,2.7,0.0,0.0,0.0,0.0,0.0,0.0,0.0,96.1,0.0,0.0,0.0,0.0,0.2,0.1
ROU Scientific research and development,0.0,0.7,0.2,0.2,0.0,0.0,0.0,3.3,0.1,0.6,0.0,0.1,0.0,0.0,0.0,1.3,0.0,0.0,0.0,0.3,0.0,0.0,0.0,337.9,0.0,0.0,0.0,1.3,4.9,0.8
ROU Advertising and market research,0.0,0.0,0.0,0.1,0.0,0.0,0.0,0.0,0.0,0.0,0.1,0.0,0.0,0.0,0.0,0.1,0.0,0.0,0.0,0.1,0.0,0.0,0.0,18.2,0.0,0.0,0.0,3.3,0.2,0.3
"ROU Other professional, scientific and technical activities; veterinary activities",0.0,0.0,0.0,0.0,0.0,0.0,0.0,0.2,0.0,0.0,0.2,0.0,0.0,0.0,0.0,0.1,0.0,0.0,0.0,0.0,0.0,0.0,0.0,49.5,0.0,0.0,0.0,0.1,0.1,0.0
ROU Administrative and support service activities,0.0,0.4,0.3,0.0,0.0,0.1,0.1,2.3,0.2,1.0,1.6,0.2,0.0,0.0,0.0,5.4,0.0,0.0,0.0,0.2,0.1,0.1,0.0,497.7,0.0,0.1,0.0,0.7,0.6,0.1
ROU Public administration and defence; compulsory social security,0.0,0.0,0.0,0.0,0.0,0.0,0.0,0.0,0.0,0.0,0.0,0.0,0.0,0.0,0.0,0.0,0.0,0.0,0.0,0.0,0.0,0.0,0.0,5055.8,0.0,0.0,0.0,0.0,0.0,0.0
ROU Education,0.0,0.0,0.0,0.0,0.0,0.0,0.0,0.0,0.0,0.0,0.1,0.0,0.0,0.0,0.0,0.0,0.0,0.0,0.0,0.0,0.0,0.0,0.0,2183.3,0.0,0.0,0.0,0.0,0.0,0.0
ROU Human health and social work activities,0.1,0.1,0.0,0.0,0.0,0.1,0.0,0.0,0.0,0.4,0.7,0.0,0.0,0.0,0.0,0.0,0.0,0.0,0.0,0.0,0.0,0.0,0.0,2948.2,0.0,0.0,0.0,0.1,0.1,1.0
ROU Other service activities,0.0,0.9,5.2,0.0,0.0,0.7,1.1,9.4,8.2,0.7,70.2,0.2,0.0,4.2,0.7,3.6,0.5,0.1,0.0,1.4,0.1,0.4,0.0,1690.4,0.0,0.6,0.0,0.8,12.0,-245.1
ROU Activities of households as employers; undifferentiated goods- and services-producing activities of households for own use,0.0,0.0,0.0,0.0,0.0,0.0,0.0,0.0,0.0,0.0,0.0,0.0,0.0,0.0,0.0,0.0,0.0,0.0,0.0,0.0,0.0,0.0,0.0,0.0,0.0,0.0,0.0,0.0,0.0,0.0
ROU Activities of extraterritorial organizations and bodies,0.0,0.0,0.0,0.0,0.0,0.0,0.0,0.0,0.0,0.0,0.0,0.0,0.0,0.0,0.0,0.0,0.0,0.0,0.0,0.0,0.0,0.0,0.0,0.0,0.0,0.0,0.0,0.0,0.0,0.0
"RUS Crop and animal production, hunting and related service activities",0.0,0.4,0.1,0.0,0.0,0.2,6.2,4.8,0.3,0.8,0.0,0.2,0.0,2.0,0.0,1.6,438.4,0.5,0.2,0.1,0.1,0.6,0.1,2.3,21848.1,0.1,0.0,0.3,22.7,4.9
RUS Forestry and logging,0.0,0.0,0.0,0.0,0.0,0.0,0.0,0.0,0.0,0.0,0.0,0.0,0.0,0.0,0.0,0.0,0.0,0.0,0.0,0.0,0.0,0.0,0.0,0.0,0.0,0.0,0.0,0.0,0.0,0.0
RUS Fishing and aquaculture,0.0,0.0,0.0,0.0,0.0,0.0,0.0,0.0,0.0,0.0,0.0,0.0,0.0,0.0,0.0,0.0,0.0,0.0,0.0,0.0,0.0,0.0,0.0,0.0,0.0,0.0,0.0,0.0,0.0,0.0
RUS Mining and quarrying,0.0,0.2,2.1,0.0,0.0,0.0,1.6,1313.2,0.2,0.2,44.8,355.4,0.0,0.0,1.2,19.0,0.0,0.0,0.0,0.2,0.0,0.1,0.3,0.0,170.8,0.1,0.0,0.9,986.3,65.0
"RUS Manufacture of food products, beverages and tobacco products",0.2,0.3,1.0,0.1,0.6,8.2,61.9,14.3,2.1,3.8,17.2,0.1,0.0,0.1,0.0,0.4,104.8,31.0,0.1,0.9,1.9,1.2,7.6,0.2,29716.7,0.4,0.0,25.7,14.0,77.4
"RUS Manufacture of textiles, wearing apparel and leather products",0.0,0.6,0.3,0.0,0.0,4.4,0.6,13.2,0.6,2.5,4.5,0.1,0.0,0.0,0.1,5.9,0.5,0.9,0.2,0.6,1.0,1.1,0.2,0.0,4237.0,0.2,0.0,113.3,14.1,12.4
"RUS Manufacture of wood and of products of wood and cork, except furniture; manufacture of articles of straw and plaiting materials",0.0,0.0,0.0,0.0,0.0,0.1,1.1,1.2,0.0,0.4,0.2,0.0,0.0,0.0,0.0,0.0,0.0,0.0,0.0,0.1,0.0,0.0,0.0,0.0,168.8,0.0,0.0,1.0,0.3,0.1
RUS Manufacture of paper and paper products,0.2,0.0,0.0,0.0,0.0,0.0,0.0,0.0,0.0,0.0,0.0,0.0,0.7,0.0,0.0,0.0,0.0,0.0,0.0,0.0,0.0,0.1,0.0,0.0,1307.1,0.0,0.5,0.0,4.5,5.7
RUS Printing and reproduction of recorded media,0.0,0.0,0.0,0.0,0.0,0.0,0.0,0.0,0.0,0.0,0.0,0.0,0.0,0.0,0.0,0.0,0.0,0.0,0.0,0.0,0.0,0.0,0.0,0.0,0.0,0.0,0.0,0.0,0.0,0.0
RUS Manufacture of coke and refined petroleum products ,0.1,0.8,17.6,1.1,0.3,1.4,48.1,88.7,32.3,45.2,93.1,7.5,0.0,0.0,0.0,43.3,5.1,5.7,0.0,119.9,1.4,4.8,8.1,4.5,1746.2,40.2,0.0,130.3,431.4,162.7
RUS Manufacture of chemicals and chemical products ,0.1,0.0,4.4,33.7,0.2,0.0,8.7,13.9,0.1,0.3,0.5,38.0,0.0,0.2,0.2,0.2,0.0,0.0,0.0,0.5,0.0,1.0,0.0,0.2,2322.6,3.0,0.0,5.8,87.5,121.6
RUS Manufacture of basic pharmaceutical products and pharmaceutical preparations,0.0,0.0,0.0,0.0,0.0,0.0,0.0,0.0,0.0,0.0,0.0,0.0,0.0,0.0,0.0,0.0,0.0,0.0,0.0,0.0,0.0,0.0,0.0,0.0,0.0,0.0,0.0,0.0,0.0,0.0
RUS Manufacture of rubber and plastic products,0.0,0.0,0.0,0.0,0.0,0.0,0.1,0.1,0.0,0.0,0.0,0.0,0.0,0.6,0.0,0.0,0.0,0.1,0.0,0.1,0.0,0.1,0.0,0.2,628.0,0.1,0.0,0.1,0.5,7.8
RUS Manufacture of other non-metallic mineral products,0.0,0.0,0.0,0.0,0.0,0.1,0.0,0.4,0.3,0.4,0.2,0.0,0.0,0.0,0.0,0.1,0.0,0.0,0.0,0.2,0.0,0.1,0.0,0.0,628.9,0.4,0.0,0.7,1.8,3.2
RUS Manufacture of basic metals,0.0,0.1,0.2,0.1,0.0,0.1,2.4,1.5,0.1,1.2,1.2,0.0,0.0,5.2,0.0,0.6,0.0,0.1,0.0,0.0,0.0,0.4,0.0,0.0,1771.3,0.4,0.0,7.1,32.5,0.0
"RUS Manufacture of fabricated metal products, except machinery and equipment",0.0,0.0,0.0,0.0,0.0,0.0,0.0,0.0,0.0,0.0,0.0,0.0,0.0,0.0,0.0,0.0,0.0,0.0,0.0,0.0,0.0,0.0,0.0,0.0,0.0,0.0,0.0,0.0,0.0,0.0
"RUS Manufacture of computer, electronic and optical products",0.4,1.8,0.7,2.1,1.3,1.9,91.6,14.1,0.8,5.2,4.7,0.5,0.5,36.7,0.1,5.2,3.1,12.6,0.2,0.4,0.3,3.2,0.0,0.5,3032.3,0.6,0.4,14.4,31.4,345.6
RUS Manufacture of electrical equipment,0.0,0.0,0.0,0.0,0.0,0.0,0.0,0.0,0.0,0.0,0.0,0.0,0.0,0.0,0.0,0.0,0.0,0.0,0.0,0.0,0.0,0.0,0.0,0.0,0.0,0.0,0.0,0.0,0.0,0.0
