,AUT,AUS,BEL,BGR,BRA,CAN,CHN,DEU,ESP,FRA,GBR,HUN,IDN,IND,IRL,ITA,JPN,KOR,MEX,NLD,NOR,POL,PRT,ROU,RUS,TUR,TWN,USA,REU,RoW
"POL Sewerage; waste collection, treatment and disposal activities; materials recovery; remediation activities and other waste management services ",0.0,0.4,0.3,0.1,0.0,0.1,0.0,3.9,0.4,0.9,1.2,0.5,0.2,0.1,0.1,0.7,0.1,0.0,0.0,1.0,0.2,1476.9,0.1,0.5,1.1,0.2,0.0,0.4,11.0,7.7
POL Construction,0.5,32.5,9.2,0.6,0.1,1.4,2.2,34.8,3.6,7.9,63.8,13.4,1.8,0.6,0.5,10.1,0.5,0.4,0.2,100.8,40.8,49646.9,2.1,5.5,25.6,1.3,0.1,3.8,172.9,66.3
POL Wholesale and retail trade and repair of motor vehicles and motorcycles,0.1,0.7,0.5,0.1,0.0,0.1,0.1,4.9,0.8,1.8,1.4,0.8,0.1,0.1,0.1,4.8,0.0,0.0,0.0,1.2,0.3,9996.7,0.1,0.2,1.1,0.8,0.0,0.3,3.2,3.8
"POL Wholesale trade, except of motor vehicles and motorcycles",3.5,29.8,26.2,13.0,0.7,8.8,4.6,402.3,29.2,81.2,90.4,41.3,2.4,1.6,7.8,88.4,3.7,3.2,1.6,63.5,20.6,23075.4,4.7,31.8,120.9,13.4,0.4,31.7,302.6,106.2
"POL Retail trade, except of motor vehicles and motorcycles",0.6,8.4,6.3,2.6,0.1,3.4,0.8,79.0,8.2,14.4,25.1,8.0,0.2,0.9,1.7,13.4,0.7,0.6,0.3,15.7,3.2,19848.5,0.7,7.0,21.9,2.4,0.1,8.3,68.5,33.5
POL Land transport and transport via pipelines,0.6,155.8,88.5,3.8,0.0,14.4,3.9,474.1,29.7,53.2,40.5,12.9,0.2,0.2,4.2,70.3,0.5,0.6,0.0,47.3,0.8,8381.4,0.4,4.2,155.0,16.2,0.3,22.5,384.3,507.9
POL Water transport,0.0,4.1,1.3,0.7,0.0,1.6,0.2,12.2,2.4,5.0,8.1,1.9,0.0,1.4,1.4,10.4,0.2,0.1,0.0,4.9,0.5,68.4,0.1,0.7,2.2,0.6,0.0,8.5,16.9,35.7
POL Air transport,0.0,9.4,3.1,1.5,0.0,3.7,0.5,28.2,5.6,11.4,18.6,4.3,0.0,3.3,3.2,24.1,0.5,0.1,0.0,11.3,1.1,157.8,0.1,1.6,5.0,1.5,0.1,19.7,38.9,82.5
POL Warehousing and support activities for transportation,0.1,20.0,33.8,0.3,0.1,0.5,0.1,169.4,7.9,21.7,9.9,3.2,0.0,0.7,1.6,30.0,0.2,0.8,0.0,5.4,1.8,3615.4,0.2,0.3,14.4,0.6,0.1,0.2,42.4,69.1
POL Postal and courier activities,0.0,3.5,6.0,0.0,0.0,0.1,0.0,29.8,1.4,3.8,1.7,0.6,0.0,0.1,0.3,5.3,0.0,0.1,0.0,0.9,0.3,636.4,0.0,0.1,2.5,0.1,0.0,0.0,7.5,12.2
POL Accommodation and food service activities,0.0,0.4,0.3,0.2,0.0,0.1,0.0,3.8,0.3,0.8,1.3,0.6,0.0,0.0,0.1,0.8,0.1,0.1,0.0,1.1,0.1,7019.5,0.0,0.6,0.8,0.1,0.0,0.4,4.0,1.0
POL Publishing activities,0.8,11.9,0.8,1.5,0.0,0.3,0.0,31.7,0.9,4.1,6.0,1.2,0.0,0.0,0.0,1.1,0.0,0.1,0.0,5.5,0.5,1889.8,4.9,2.0,1.0,0.1,0.2,5.5,35.9,80.6
"POL Motion picture, video and television programme production, sound recording and music publishing activities; programming and broadcasting activities",1.0,3.6,11.6,2.7,0.5,0.8,0.0,61.2,4.8,19.4,19.4,3.2,4.1,0.0,0.1,6.9,0.5,3.1,0.4,10.3,0.7,1658.4,2.8,1.7,0.1,0.0,2.9,14.6,64.3,94.9
POL Telecommunications,0.1,2.8,7.4,0.4,0.0,0.9,0.3,17.3,8.8,8.0,20.2,2.1,0.9,0.1,5.2,41.4,0.1,0.1,0.5,8.9,1.6,8545.2,0.2,0.6,5.0,0.1,0.2,0.5,38.9,38.3
"POL Computer programming, consultancy and related activities; information service activities",0.2,0.3,0.1,1.6,0.0,3.8,0.2,21.8,1.7,3.3,11.4,1.5,0.0,0.1,0.1,2.3,0.1,0.1,0.0,16.6,1.7,1311.4,0.3,4.9,0.2,0.1,0.1,6.5,92.8,208.0
"POL Financial service activities, except insurance and pension funding",0.1,4.9,0.4,0.0,0.1,0.3,0.0,4.5,12.9,1.8,7.9,0.4,0.3,0.0,2.6,2.3,0.0,0.1,0.0,20.9,0.4,7250.3,0.5,0.1,0.4,0.5,0.0,0.9,15.0,158.4
"POL Insurance, reinsurance and pension funding, except compulsory social security",0.0,0.6,0.7,0.0,0.0,0.0,0.0,1.5,0.0,1.4,0.2,0.1,0.0,0.1,4.8,1.0,0.1,0.0,0.2,0.2,0.0,5130.4,0.0,0.0,0.0,0.0,0.0,3.0,6.1,34.5
POL Activities auxiliary to financial services and insurance activities,0.0,0.5,0.2,0.0,0.0,0.0,0.0,0.9,0.5,0.2,0.9,0.0,0.0,0.0,0.0,0.6,0.0,0.0,0.0,0.5,0.0,2402.3,0.1,0.0,0.2,0.0,0.0,0.6,1.8,8.3
POL Real estate activities,0.4,3.3,0.4,0.0,0.1,0.3,0.1,55.8,0.6,0.6,21.4,0.2,0.2,0.1,0.1,15.6,0.0,0.6,0.0,122.6,0.9,28695.5,0.1,0.1,0.8,0.1,0.2,0.3,5.6,16.7
POL Legal and accounting activities; activities of head offices; management consultancy activities,0.9,2.4,13.1,0.7,0.0,1.1,6.8,11.0,15.1,10.1,2.6,0.7,0.0,1.1,0.2,10.7,0.0,0.1,0.0,72.9,13.6,606.2,0.3,1.7,0.1,0.0,0.0,11.8,48.3,41.5
POL Architectural and engineering activities; technical testing and analysis,0.0,0.4,0.4,0.1,0.0,0.1,0.1,6.9,0.4,1.4,1.9,0.3,0.2,34.7,0.2,1.2,0.0,0.0,0.0,2.0,1.3,4681.2,0.1,0.3,0.8,0.2,0.0,0.3,4.5,18.9
POL Scientific research and development,0.2,2.5,3.8,1.0,0.1,0.7,1.4,34.8,3.6,10.6,5.2,3.1,0.1,0.2,0.6,6.2,0.1,3.7,0.1,28.3,0.5,978.8,0.4,1.8,4.4,0.7,0.0,6.3,97.6,7.8
POL Advertising and market research,0.0,0.4,0.1,0.6,0.0,0.1,0.0,2.1,0.3,0.5,1.2,0.1,0.0,0.0,0.1,0.3,0.0,0.3,0.0,4.0,0.1,152.9,0.2,0.2,0.1,0.0,0.0,17.5,8.3,32.9
"POL Other professional, scientific and technical activities; veterinary activities",0.3,2.0,1.4,0.9,0.1,1.3,0.3,23.5,1.9,6.1,40.3,5.8,0.0,0.2,60.2,10.8,0.4,1.1,0.1,19.0,7.5,1500.4,0.9,1.4,1.5,1.0,0.1,3.0,26.8,19.4
POL Administrative and support service activities,0.1,1.6,0.8,0.5,0.0,0.4,0.1,8.8,3.2,2.8,7.8,1.3,0.0,0.0,0.5,3.9,0.1,0.1,0.0,5.7,0.6,3333.7,0.1,1.0,1.5,0.2,0.0,5.6,15.8,26.3
POL Public administration and defence; compulsory social security,0.0,0.1,0.0,0.0,0.0,0.0,0.0,0.5,0.0,0.0,0.1,0.0,0.0,0.0,0.0,0.1,0.0,0.0,0.0,0.6,0.0,28951.4,0.0,0.0,0.0,0.0,0.0,0.0,0.3,2.0
POL Education,0.3,0.3,0.1,0.1,0.0,0.1,0.1,1.6,0.1,0.3,0.7,0.1,0.0,1.2,0.0,0.2,0.0,0.1,0.0,1.5,0.0,23307.3,0.1,0.1,0.1,0.0,0.0,0.3,4.4,10.4
POL Human health and social work activities,0.4,0.2,0.1,0.2,0.0,0.2,0.1,2.2,0.2,1.2,5.4,0.4,0.0,0.0,1.5,0.6,0.0,0.0,0.0,1.5,0.2,19588.9,0.0,0.2,0.2,0.0,0.0,0.6,2.7,27.7
POL Other service activities,0.3,2.3,2.1,0.8,0.1,8.1,1.4,27.8,21.4,4.4,51.6,1.9,0.4,4.5,1.8,4.6,0.5,0.4,0.1,6.0,1.0,9332.5,0.4,0.8,3.8,1.2,0.4,2.8,46.0,38.6
POL Activities of households as employers; undifferentiated goods- and services-producing activities of households for own use,0.0,0.0,0.0,0.0,0.0,0.0,0.0,0.0,0.0,0.0,0.0,0.0,0.0,0.0,0.0,0.0,0.0,0.0,0.0,0.0,0.0,650.1,0.0,0.0,0.0,0.0,0.0,0.0,0.0,-0.0
POL Activities of extraterritorial organizations and bodies,0.0,0.0,0.0,0.0,0.0,0.0,0.0,0.0,0.0,0.0,0.0,0.0,0.0,0.0,0.0,0.0,0.0,0.0,0.0,0.0,0.0,0.0,0.0,0.0,0.0,0.0,0.0,0.0,0.0,0.0
"PRT Crop and animal production, hunting and related service activities",0.1,0.2,4.6,0.0,16.7,1.6,0.1,7.8,134.9,42.1,70.4,0.4,0.0,0.0,6.5,18.3,0.6,0.1,0.1,18.3,2.4,2.4,2784.5,0.2,1.9,0.2,0.0,1.6,6.5,31.5
PRT Forestry and logging,0.0,0.0,0.3,0.0,0.0,0.0,0.0,0.2,2.0,0.1,0.1,0.0,0.0,0.0,0.0,0.1,0.0,0.0,0.0,0.4,0.0,0.0,234.3,0.0,0.0,0.0,0.1,0.8,0.0,0.1
PRT Fishing and aquaculture,0.0,0.0,0.1,0.0,0.1,0.1,0.0,0.4,44.0,6.0,0.1,0.0,0.0,0.0,0.0,6.4,0.0,0.0,0.0,0.0,0.0,0.0,484.4,0.0,3.6,0.0,0.0,0.0,0.5,6.4
PRT Mining and quarrying,0.0,0.0,0.2,0.0,0.0,0.0,0.3,6.4,0.5,0.6,1.6,0.0,0.0,0.0,0.1,0.3,0.0,0.0,0.0,3.6,0.0,0.0,43.4,0.0,0.0,0.0,0.0,3.4,0.4,-0.0
"PRT Manufacture of food products, beverages and tobacco products",5.4,6.9,59.1,0.7,189.6,52.5,4.9,100.7,521.3,275.1,199.9,6.4,0.1,0.4,9.5,217.2,15.3,2.6,2.9,69.4,9.7,7.8,10317.1,1.2,12.1,4.1,0.9,52.6,102.4,439.7
"PRT Manufacture of textiles, wearing apparel and leather products",7.8,51.1,57.7,0.7,5.7,34.3,4.2,552.6,983.4,680.5,615.1,1.2,0.3,1.1,32.6,189.9,17.4,3.9,27.3,120.4,48.4,22.3,5255.4,3.3,53.5,6.4,0.7,236.5,253.3,246.7
"PRT Manufacture of wood and of products of wood and cork, except furniture; manufacture of articles of straw and plaiting materials",1.1,0.0,1.0,0.0,0.0,0.1,0.0,2.0,2.3,1.7,0.4,0.0,0.0,0.0,0.2,0.4,0.0,0.0,0.0,0.5,0.0,0.0,92.7,0.0,0.0,0.0,0.1,0.3,0.8,1.4
PRT Manufacture of paper and paper products,0.0,0.1,0.3,0.0,0.0,0.0,0.0,0.9,33.7,5.1,2.0,0.0,0.2,0.0,0.5,0.3,0.4,0.0,0.0,0.8,0.2,0.0,855.3,0.1,0.1,0.0,0.0,0.2,1.9,7.2
PRT Printing and reproduction of recorded media,0.0,0.0,0.1,0.0,0.0,0.0,0.0,0.7,2.5,1.9,0.6,0.0,0.0,0.0,0.1,0.4,0.0,0.0,0.0,0.2,0.1,0.0,77.7,0.0,0.0,0.0,0.0,0.3,0.4,-0.0
PRT Manufacture of coke and refined petroleum products ,0.1,0.1,1.0,0.0,2.9,1.7,0.0,1.5,44.1,6.7,23.8,0.1,0.0,0.0,0.0,0.7,0.0,0.0,0.0,4.5,0.1,0.3,3802.7,0.0,0.2,3.4,0.0,153.3,1.1,88.7
PRT Manufacture of chemicals and chemical products ,1.8,0.2,6.0,0.1,0.4,0.1,0.1,14.9,51.4,29.3,19.6,1.6,0.0,0.1,0.2,7.8,0.1,0.0,0.5,26.0,0.1,6.1,803.1,0.6,3.4,0.5,0.0,3.1,12.6,30.2
PRT Manufacture of basic pharmaceutical products and pharmaceutical preparations,0.4,0.3,1.2,0.1,0.2,0.5,0.0,58.5,10.2,14.5,17.9,0.1,0.0,0.0,1.9,3.7,0.0,0.5,0.5,1.0,0.3,2.1,627.2,0.1,0.0,0.0,0.0,10.6,18.1,61.4
PRT Manufacture of rubber and plastic products,0.8,3.1,13.1,0.3,2.3,0.4,0.5,23.9,66.4,85.9,7.6,1.8,0.3,3.0,0.3,6.5,0.7,0.1,3.5,16.5,1.6,3.2,254.9,1.9,0.5,1.6,0.0,7.2,8.9,49.4
PRT Manufacture of other non-metallic mineral products,1.0,1.1,4.3,0.1,0.9,3.3,0.3,46.9,30.4,63.3,45.3,0.1,0.0,0.1,4.2,10.7,1.6,0.5,3.8,12.4,1.7,1.3,389.1,0.1,0.8,0.2,0.0,56.3,20.6,15.4
PRT Manufacture of basic metals,0.0,0.0,0.1,0.0,0.1,1.7,0.0,0.6,1.3,0.7,0.2,0.0,0.0,0.0,1.5,0.2,0.0,0.0,0.1,0.2,0.0,0.1,82.9,0.0,0.0,0.0,0.0,0.3,0.7,-0.0
"PRT Manufacture of fabricated metal products, except machinery and equipment",1.6,3.9,21.0,0.8,8.4,3.5,3.1,75.7,215.7,131.8,49.1,1.9,0.1,2.7,6.0,16.5,2.7,0.3,24.4,12.8,3.0,16.0,697.3,1.6,1.8,5.4,4.1,49.5,40.4,166.9
"PRT Manufacture of computer, electronic and optical products",3.4,6.7,103.9,2.6,7.5,2.3,5.7,474.6,208.8,79.7,51.0,1.0,0.0,0.7,1.3,88.3,1.9,11.8,3.9,3.5,1.8,18.3,1026.2,6.1,3.2,22.0,0.7,58.8,55.4,138.5
PRT Manufacture of electrical equipment,2.3,2.5,7.8,0.4,3.0,0.5,12.6,62.4,107.3,30.3,35.7,3.9,0.0,0.2,2.4,23.9,2.2,1.9,1.6,7.2,0.6,4.2,486.7,0.8,0.3,2.2,0.8,31.6,28.6,151.4
PRT Manufacture of machinery and equipment n.e.c.,6.4,2.2,11.4,0.6,11.1,3.9,9.2,138.0,184.6,64.7,30.5,1.1,0.2,2.6,1.6,37.3,1.5,0.8,7.3,11.9,2.0,6.8,515.7,9.8,6.6,4.6,2.0,37.1,28.1,331.4
"PRT Manufacture of motor vehicles, trailers and semi-trailers",65.3,134.5,105.4,1.2,1.4,42.2,2.0,409.4,271.8,611.7,88.1,10.3,0.0,0.2,16.0,136.3,8.4,3.3,3.6,38.4,7.9,10.3,2348.0,2.3,15.7,22.4,0.0,373.5,67.5,348.8
PRT Manufacture of other transport equipment,0.0,1.0,0.6,0.0,0.2,0.3,0.1,15.6,44.6,74.1,7.1,0.7,0.1,0.1,0.1,3.4,0.0,0.2,0.0,8.4,1.3,0.6,91.9,0.1,0.3,0.1,0.7,0.6,9.5,9.1
PRT Manufacture of furniture; other manufacturing,1.0,2.0,4.5,0.5,2.2,3.4,0.3,41.9,155.3,156.5,26.4,0.5,0.0,0.1,3.4,17.3,0.6,0.9,0.4,13.0,5.1,1.5,1781.9,0.3,0.9,0.9,0.1,13.4,22.2,108.1
PRT Repair and installation of machinery and equipment,0.1,2.2,1.4,0.0,1.5,0.2,0.1,12.1,11.7,57.3,2.1,0.4,0.0,0.1,0.2,3.5,0.0,0.0,0.2,5.6,3.5,0.3,648.4,0.3,0.1,0.1,19.2,1.4,8.3,9.8
"PRT Electricity, gas, steam and air conditioning supply",0.0,0.2,1.6,0.0,1.1,0.0,0.0,5.6,1.3,0.5,0.4,0.0,0.0,0.0,0.0,0.8,0.0,0.0,0.0,0.9,0.0,0.0,3714.6,0.0,0.0,0.0,0.0,0.3,1.1,1.9
"PRT Water collection, treatment and supply",0.0,0.0,0.0,0.0,0.0,0.0,0.0,0.0,0.0,0.0,0.0,0.0,0.0,0.0,0.0,0.0,0.0,0.0,0.0,0.0,0.0,0.0,754.7,0.0,0.0,0.0,0.0,0.0,0.0,-23.0
"PRT Sewerage; waste collection, treatment and disposal activities; materials recovery; remediation activities and other waste management services ",0.0,0.0,0.1,0.0,0.0,0.1,0.0,0.2,0.2,0.1,0.0,0.0,0.0,0.0,0.1,0.1,0.0,0.0,0.0,0.0,0.0,0.0,671.2,0.0,0.0,0.0,0.0,0.0,0.2,1.9
PRT Construction,0.2,0.6,2.7,0.0,0.1,0.7,0.3,3.0,4.6,3.7,11.1,0.1,0.0,0.0,0.3,2.2,0.1,0.0,0.3,9.9,0.1,1.0,26622.8,0.4,0.1,0.1,0.1,2.5,3.1,64.0
PRT Wholesale and retail trade and repair of motor vehicles and motorcycles,0.0,0.1,0.1,0.0,0.0,0.0,0.0,0.6,1.5,2.2,0.3,0.0,0.0,0.0,0.0,0.2,0.0,0.0,0.0,0.3,0.0,0.0,5027.0,0.0,0.0,0.0,0.0,0.2,0.4,1.1
"PRT Wholesale trade, except of motor vehicles and motorcycles",0.8,3.3,19.4,0.3,7.6,3.4,0.6,101.8,134.6,91.8,34.0,1.1,0.1,0.1,26.4,93.6,1.6,1.4,1.1,20.3,2.9,3.7,2682.5,0.7,1.7,1.8,9.5,18.2,35.8,2339.7
"PRT Retail trade, except of motor vehicles and motorcycles",0.3,1.2,3.6,0.1,7.3,2.6,0.3,18.0,56.2,54.0,17.7,0.6,0.0,0.1,1.3,11.6,0.7,0.3,0.3,8.0,1.3,0.9,12575.0,0.2,0.9,0.4,0.5,8.0,12.1,58.3
PRT Land transport and transport via pipelines,0.3,9.6,17.2,0.0,3.9,0.9,0.3,31.9,58.8,27.7,23.3,0.3,0.2,0.0,0.6,16.2,0.0,0.0,0.0,6.1,0.1,2.0,2428.3,0.1,0.4,0.2,0.2,4.1,48.7,241.3
PRT Water transport,0.0,0.1,0.0,0.0,0.0,0.1,0.0,1.4,0.9,0.2,5.9,0.0,0.0,0.0,0.0,0.2,0.0,0.0,0.0,1.1,0.1,0.0,168.9,0.1,0.0,0.0,0.0,0.0,0.8,82.4
PRT Air transport,0.0,10.5,11.6,0.3,83.1,4.0,0.6,28.9,210.5,120.2,176.0,2.0,0.9,0.0,7.5,108.7,0.2,0.1,0.1,21.3,6.5,0.7,734.8,0.6,0.2,0.1,2.5,69.8,63.0,101.5
PRT Warehousing and support activities for transportation,0.2,5.4,31.1,0.0,29.9,0.1,0.0,53.6,58.9,49.5,11.2,0.3,0.1,0.0,0.0,31.9,0.0,0.1,0.0,2.2,2.7,0.3,1451.8,0.0,0.2,0.0,0.4,0.1,13.6,46.2
PRT Postal and courier activities,0.0,0.0,0.1,0.0,0.0,0.0,0.0,0.3,2.8,0.8,2.9,0.0,0.0,0.0,0.1,0.1,0.0,0.0,0.0,0.2,0.0,0.0,188.0,0.0,0.0,0.0,0.0,0.0,0.2,12.9
PRT Accommodation and food service activities,0.2,1.7,10.0,0.0,9.8,8.1,0.1,17.3,9.2,0.5,85.6,0.2,0.4,0.0,62.9,4.7,0.1,0.0,0.0,0.2,0.0,0.0,15887.4,0.1,0.0,0.0,0.6,0.2,30.0,58.0
PRT Publishing activities,0.2,0.6,0.4,0.1,0.0,0.0,0.0,1.3,1.3,0.7,0.6,0.0,0.1,0.0,0.1,4.2,0.0,0.1,0.0,0.9,0.0,0.3,1314.0,0.1,0.0,0.0,0.2,0.1,1.0,39.0
"PRT Motion picture, video and television programme production, sound recording and music publishing activities; programming and broadcasting activities",0.4,0.5,3.8,1.7,1.6,0.4,0.0,24.1,13.9,10.8,10.1,0.0,7.8,0.0,0.0,3.5,0.1,0.9,0.5,3.9,0.1,0.7,565.6,3.8,0.0,0.0,3.9,6.2,2.2,47.4
PRT Telecommunications,0.3,1.0,5.0,0.1,1.6,0.3,0.1,11.3,74.6,16.1,50.5,0.3,5.0,0.1,0.7,11.0,0.2,0.2,0.3,5.7,0.5,1.0,4559.7,0.6,1.0,0.1,2.9,0.3,11.1,41.1
"PRT Computer programming, consultancy and related activities; information service activities",0.1,0.0,0.7,0.0,0.1,1.1,0.0,4.3,2.6,0.9,0.6,0.0,0.1,0.0,0.1,1.0,0.4,0.2,0.0,0.5,0.1,0.3,1427.9,0.2,0.0,0.1,0.2,0.5,1.2,48.3
"PRT Financial service activities, except insurance and pension funding",0.1,0.1,0.2,0.0,0.6,0.8,0.0,1.6,36.5,2.0,5.3,0.0,0.6,0.0,2.4,0.7,0.1,0.2,0.0,3.4,0.0,0.4,5617.2,0.0,0.0,0.2,0.0,0.0,2.4,105.7
"PRT Insurance, reinsurance and pension funding, except compulsory social security",0.0,0.1,0.4,0.0,0.0,0.0,0.0,1.2,1.3,0.9,0.8,0.0,0.0,0.0,0.1,0.2,0.0,0.0,0.0,0.2,0.0,0.0,4332.2,0.1,0.0,0.0,0.0,1.3,2.5,13.4
PRT Activities auxiliary to financial services and insurance activities,0.0,0.1,1.7,0.0,0.0,0.0,0.0,0.4,6.0,0.0,1.3,0.0,0.0,0.0,0.1,0.9,0.0,0.1,0.0,0.1,0.0,0.1,159.0,0.0,0.0,0.0,0.0,0.0,1.1,30.7
PRT Real estate activities,0.0,0.0,0.0,0.0,0.0,0.0,0.0,0.5,0.2,0.0,0.4,0.0,0.3,0.0,0.0,0.5,0.0,0.0,0.0,0.5,0.0,0.0,18933.7,0.0,0.0,0.0,0.0,0.1,0.0,2.2
PRT Legal and accounting activities; activities of head offices; management consultancy activities,0.8,0.1,3.8,0.0,0.3,0.4,0.9,2.0,33.3,7.9,0.7,0.0,0.9,0.0,0.1,8.0,0.0,0.0,0.0,5.8,0.7,1.0,1450.6,0.2,0.0,0.0,0.1,2.2,6.5,22.2
PRT Architectural and engineering activities; technical testing and analysis,0.0,0.0,0.1,0.0,0.0,0.0,0.0,0.5,0.7,0.3,0.1,0.0,0.0,0.3,0.1,1.0,0.0,0.0,0.0,0.1,0.0,0.0,490.4,0.0,0.0,0.0,0.0,0.1,0.3,4.1
PRT Scientific research and development,0.0,0.0,0.1,0.0,0.0,0.0,0.0,0.5,0.4,0.6,0.1,0.0,0.0,0.0,0.0,0.3,0.0,0.1,0.0,0.2,0.0,0.0,741.6,0.0,0.0,0.0,0.0,0.1,1.5,0.3
PRT Advertising and market research,0.0,0.1,0.4,0.2,0.2,0.0,0.0,2.7,1.8,1.3,1.2,0.0,0.9,0.0,0.0,0.4,0.0,0.1,0.1,0.6,0.0,0.1,70.0,0.4,0.0,0.0,0.5,2.1,0.4,20.2
"PRT Other professional, scientific and technical activities; veterinary activities",0.0,0.0,0.2,0.0,0.0,0.6,0.0,1.5,0.2,0.1,17.2,0.4,0.0,0.0,18.2,7.7,0.4,0.4,0.0,1.7,0.6,0.7,183.2,0.0,0.0,0.0,0.2,0.5,1.0,9.7
PRT Administrative and support service activities,0.1,0.1,0.3,0.0,0.1,0.3,0.0,0.8,15.7,4.3,3.8,0.1,0.0,0.0,0.4,1.6,0.0,0.0,0.0,1.3,0.1,0.1,769.3,0.0,0.0,0.0,0.1,5.9,0.7,3.7
PRT Public administration and defence; compulsory social security,0.1,0.1,0.8,0.0,0.5,0.1,0.1,1.2,4.8,1.7,1.5,0.0,0.1,0.0,0.7,1.5,0.0,0.0,0.0,0.7,0.1,0.1,21825.8,0.0,0.0,0.0,0.0,0.6,1.1,7.7
PRT Education,0.0,0.0,0.2,0.0,0.0,0.1,0.0,0.8,0.8,1.0,0.3,0.0,0.0,0.0,0.0,0.4,0.0,0.1,0.0,0.3,0.0,0.0,15252.6,0.0,0.0,0.0,0.0,0.2,2.3,1.0
PRT Human health and social work activities,0.0,0.0,0.0,0.0,0.0,0.0,0.0,0.3,0.5,0.3,0.6,0.0,0.0,0.0,0.2,0.1,0.0,0.0,0.0,0.1,0.0,0.0,18790.4,0.0,0.0,0.0,0.0,0.1,0.3,2.5
PRT Other service activities,0.0,0.1,0.2,0.0,0.1,0.4,0.0,2.8,38.7,0.4,12.4,0.0,0.0,0.1,0.1,0.5,0.0,0.0,0.0,0.6,0.0,0.1,6103.9,0.2,0.0,0.1,0.3,0.1,6.2,1.7
PRT Activities of households as employers; undifferentiated goods- and services-producing activities of households for own use,0.0,0.0,0.0,0.0,0.0,0.0,0.0,0.0,0.0,0.0,0.0,0.0,0.0,0.0,0.0,0.0,0.0,0.0,0.0,0.0,0.0,0.0,1476.1,0.0,0.0,0.0,0.0,0.0,0.0,0.4
PRT Activities of extraterritorial organizations and bodies,0.0,0.0,0.0,0.0,0.0,0.0,0.0,0.0,0.0,0.0,0.0,0.0,0.0,0.0,0.0,0.0,0.0,0.0,0.0,0.0,0.0,0.0,0.0,0.0,0.0,0.0,0.0,0.0,0.0,0.0
"ROU Crop and animal production, hunting and related service activities",0.0,3.2,1.1,4.5,0.0,0.2,0.3,18.7,4.7,7.2,2.8,8.0,0.0,0.2,0.3,28.9,0.1,0.1,0.1,9.3,0.9,3.8,0.1,6829.2,1.2,5.9,0.0,0.5,12.4,6.5
ROU Forestry and logging,0.0,0.1,0.0,0.0,0.0,0.0,0.0,0.5,0.1,0.1,0.1,0.1,0.0,0.0,0.1,0.2,0.0,0.0,0.0,0.1,0.2,0.1,0.0,574.8,0.0,0.1,0.0,0.1,0.2,0.1
ROU Fishing and aquaculture,0.0,0.0,0.3,0.0,0.0,0.0,0.0,0.0,0.0,0.3,0.0,0.0,0.0,0.0,0.0,0.0,0.0,0.0,0.0,0.0,0.0,0.0,0.0,13.1,0.0,0.0,0.0,0.0,0.0,0.0
ROU Mining and quarrying,0.0,0.6,0.2,0.2,0.0,0.2,0.1,6.2,0.5,4.6,0.3,0.4,0.0,0.1,0.1,1.6,0.0,0.0,0.0,0.7,0.0,0.4,0.0,750.9,0.2,1.0,0.0,0.2,1.1,0.1
"ROU Manufacture of food products, beverages and tobacco products",0.1,6.7,4.1,61.4,0.0,1.4,0.7,18.9,3.3,9.4,1.7,21.3,0.0,0.1,0.2,76.2,0.2,0.2,0.3,5.1,0.4,4.5,0.2,17674.2,2.9,3.1,0.1,4.1,41.9,113.6
"ROU Manufacture of textiles, wearing apparel and leather products",2.3,62.9,12.3,3.3,0.6,14.4,1.8,569.0,45.8,288.8,422.9,77.9,0.0,0.0,8.6,1205.1,15.1,1.9,2.6,25.0,16.9,20.6,1.6,3546.6,24.5,3.4,0.1,52.0,79.1,103.1
"ROU Manufacture of wood and of products of wood and cork, except furniture; manufacture of articles of straw and plaiting materials",0.0,2.4,1.8,0.2,0.0,0.5,0.1,7.7,0.9,9.1,2.9,0.7,0.0,0.0,0.3,5.1,0.1,0.0,0.0,1.1,0.3,0.9,0.1,300.1,0.4,0.3,0.0,1.5,6.0,0.6
ROU Manufacture of paper and paper products,0.0,0.2,0.3,1.8,0.0,0.1,0.1,1.8,0.1,1.5,0.1,0.7,0.0,0.0,0.0,2.1,0.0,0.1,0.0,0.1,0.0,0.9,0.0,378.5,3.7,0.2,0.0,0.1,1.1,11.9
ROU Printing and reproduction of recorded media,0.0,0.0,0.0,0.1,0.0,0.0,0.0,0.2,0.0,0.1,0.0,0.1,0.0,0.0,0.0,0.2,0.0,0.0,0.0,0.0,0.0,0.1,0.0,-334.0,0.2,0.0,0.0,0.1,0.1,0.0
ROU Manufacture of coke and refined petroleum products ,0.0,0.8,0.5,93.5,0.0,0.0,0.0,3.6,0.5,11.9,1.5,36.7,0.0,0.0,0.0,8.6,0.0,0.0,0.8,1.7,0.1,0.3,0.5,839.4,0.3,112.8,0.0,1.8,69.8,133.5
ROU Manufacture of chemicals and chemical products ,0.0,2.4,0.6,24.7,0.2,0.1,0.2,3.8,0.3,3.4,0.9,8.5,0.1,0.1,0.0,3.3,0.2,0.1,0.1,1.4,0.0,8.8,0.0,1821.5,4.0,1.3,0.0,1.1,7.7,40.9
ROU Manufacture of basic pharmaceutical products and pharmaceutical preparations,0.0,1.0,0.1,2.7,0.1,0.0,0.0,1.4,0.0,1.3,0.6,3.8,0.0,0.0,0.0,1.0,0.0,0.0,0.0,0.0,0.0,2.4,0.0,642.5,0.0,0.0,0.0,0.4,1.8,6.0
ROU Manufacture of rubber and plastic products,0.0,4.1,1.4,1.7,0.2,0.1,0.3,15.3,4.6,20.8,3.2,7.8,0.1,0.9,0.1,28.3,0.1,0.1,0.4,3.1,0.2,1.3,0.1,637.0,0.8,2.1,0.0,1.0,6.0,11.9
ROU Manufacture of other non-metallic mineral products,0.3,4.9,3.5,2.4,0.0,1.3,0.3,38.3,3.8,20.2,9.1,2.6,0.0,0.1,0.1,8.0,0.5,0.0,0.4,5.5,0.4,8.3,0.1,-219.8,3.9,1.5,0.4,7.5,19.5,8.7
ROU Manufacture of basic metals,0.0,0.4,0.2,0.9,0.0,1.8,0.3,3.2,0.4,1.3,0.5,1.3,0.0,0.2,0.1,2.3,0.0,0.1,0.1,0.7,0.1,1.0,0.0,230.6,0.5,0.7,0.0,0.7,2.8,0.0
"ROU Manufacture of fabricated metal products, except machinery and equipment",0.1,6.5,2.3,3.3,0.8,2.3,1.3,36.6,3.6,19.0,9.6,6.2,0.1,3.3,0.7,40.8,0.4,0.4,0.2,4.6,1.2,4.6,0.3,837.3,1.6,4.8,0.2,15.4,23.2,43.1
"ROU Manufacture of computer, electronic and optical products",2.6,4.8,4.0,10.0,0.6,2.1,3.2,74.9,17.9,23.9,8.2,19.8,0.1,8.3,1.2,58.6,3.5,2.1,0.4,4.4,8.0,16.9,0.2,706.0,5.9,2.4,0.5,31.0,87.4,91.5
ROU Manufacture of electrical equipment,2.6,34.4,14.0,26.5,2.0,4.0,18.8,213.7,33.0,79.7,55.3,43.4,0.3,3.1,1.5,253.8,2.3,1.7,1.8,4.0,4.1,46.9,2.8,-449.4,6.3,76.6,0.1,11.4,103.7,121.7
ROU Manufacture of machinery and equipment n.e.c.,1.1,15.2,11.1,7.5,0.6,2.2,20.1,150.1,15.3,38.5,17.3,69.0,1.7,8.7,0.7,86.1,0.5,6.4,3.9,9.1,4.2,51.8,0.4,1289.9,23.6,35.1,0.4,21.9,44.2,86.0
"ROU Manufacture of motor vehicles, trailers and semi-trailers",0.7,6.4,3.7,7.2,0.2,0.5,1.9,69.9,17.2,122.1,2.9,10.5,0.1,2.8,0.2,36.2,0.8,0.9,0.3,7.2,2.1,12.8,0.5,3611.8,3.8,29.0,0.1,8.1,34.0,84.3
ROU Manufacture of other transport equipment,0.1,18.5,1.7,0.8,0.0,0.8,0.2,268.8,4.5,33.1,17.4,17.3,0.0,2.6,54.7,27.2,0.4,0.0,0.0,69.3,154.2,39.0,0.6,365.8,1.6,2.4,0.0,2.6,33.5,174.1
ROU Manufacture of furniture; other manufacturing,1.7,74.2,16.9,7.3,0.1,14.3,2.1,156.2,18.3,385.6,75.6,45.3,0.0,0.2,18.8,273.0,5.0,0.7,0.4,72.3,13.8,13.6,3.0,1007.4,3.8,5.3,0.1,50.8,77.5,75.6
ROU Repair and installation of machinery and equipment,0.0,2.0,0.2,0.1,0.0,0.0,0.2,3.3,0.2,2.6,0.3,0.7,0.0,0.1,0.3,1.0,0.0,0.0,0.0,1.2,1.1,0.6,0.1,549.4,0.2,0.3,0.3,0.3,1.4,2.0
"ROU Electricity, gas, steam and air conditioning supply",0.1,1.7,2.2,1.0,0.0,0.3,0.4,15.3,0.9,1.8,1.1,2.4,0.0,0.3,0.1,5.8,0.1,0.1,0.1,1.7,0.2,1.3,0.1,3903.7,0.4,2.0,0.0,0.9,4.7,7.5
"ROU Water collection, treatment and supply",0.0,0.0,0.0,0.0,0.0,0.0,0.0,0.3,0.0,0.2,0.0,0.1,0.0,0.0,0.0,0.2,0.0,0.0,0.0,0.0,0.0,0.1,0.0,569.1,0.0,0.1,0.0,0.0,0.1,0.5
"ROU Sewerage; waste collection, treatment and disposal activities; materials recovery; remediation activities and other waste management services ",0.0,0.0,0.0,0.0,0.0,0.0,0.0,0.1,0.0,0.0,0.0,0.0,0.0,0.0,0.0,0.1,0.0,0.0,0.0,0.0,0.0,0.0,0.0,374.4,0.0,0.0,0.0,0.0,0.4,1.5
ROU Construction,0.1,2.3,0.7,0.6,0.0,0.3,0.7,11.6,1.2,4.9,2.1,2.8,0.0,0.4,1.0,6.1,0.1,0.2,0.1,2.7,2.6,3.0,0.2,26826.4,0.7,1.9,0.0,0.9,4.6,40.3
ROU Wholesale and retail trade and repair of motor vehicles and motorcycles,0.0,0.3,0.1,0.0,0.0,0.1,0.0,0.7,0.1,0.3,0.1,0.1,0.0,0.0,0.0,0.4,0.0,0.0,0.0,0.1,0.1,0.1,0.0,699.8,0.1,0.1,0.0,0.0,0.3,1.8
"ROU Wholesale trade, except of motor vehicles and motorcycles",0.1,9.0,4.6,4.9,0.1,1.5,0.6,39.3,7.2,27.1,17.7,9.0,0.0,0.6,3.9,71.8,0.9,0.2,0.2,16.7,0.9,4.4,0.2,3678.1,2.0,2.9,0.1,3.9,15.8,396.6
"ROU Retail trade, except of motor vehicles and motorcycles",0.0,6.5,3.8,1.5,0.0,1.5,0.2,17.3,2.2,8.4,5.7,2.6,0.0,0.4,0.6,18.7,0.2,0.1,0.0,2.7,1.0,1.8,0.1,2606.6,1.7,1.9,0.0,1.2,9.4,601.5
ROU Land transport and transport via pipelines,0.1,136.3,44.8,18.8,0.0,38.7,3.1,127.2,23.4,47.4,37.2,20.6,0.2,0.4,0.4,70.4,0.1,0.1,0.0,29.5,0.1,13.4,0.4,10025.9,41.7,62.2,0.1,2.6,115.7,460.1
ROU Water transport,0.0,0.3,0.0,0.2,0.0,0.5,0.0,1.0,0.1,0.1,1.6,0.2,0.0,0.5,0.0,0.2,0.0,0.0,0.0,0.9,0.0,0.1,0.0,66.8,0.2,2.0,0.0,0.0,0.4,35.4
ROU Air transport,0.0,8.5,1.7,7.9,0.0,10.0,0.4,6.4,4.8,11.2,15.7,7.4,0.1,4.0,0.2,26.2,0.1,0.0,0.0,5.8,0.2,0.3,0.2,123.4,1.0,1.8,0.0,2.4,13.5,13.3
ROU Warehousing and support activities for transportation,0.0,17.5,14.0,2.9,0.0,3.9,0.2,39.0,5.3,16.7,7.9,5.6,0.0,1.9,0.1,28.4,0.1,0.1,0.0,4.1,0.3,0.9,0.2,576.2,4.2,5.0,0.0,0.6,16.3,52.8
ROU Postal and courier activities,0.0,0.4,0.2,0.2,0.0,0.2,0.0,0.8,0.7,0.6,1.0,0.3,0.0,0.1,0.0,0.8,0.0,0.0,0.0,0.4,0.0,0.0,0.0,89.3,0.0,0.0,0.0,0.0,0.5,6.2
ROU Accommodation and food service activities,0.8,15.5,7.5,6.4,0.2,21.1,1.2,58.2,6.3,0.7,41.2,14.6,0.0,0.2,15.4,124.9,5.5,0.1,0.0,0.3,0.0,0.3,1.2,2395.4,0.2,0.3,0.3,0.2,38.4,184.4
ROU Publishing activities,0.0,0.0,0.1,0.0,0.0,0.0,0.0,0.2,0.0,0.1,0.0,0.0,0.0,0.0,0.0,0.0,0.0,0.0,0.0,0.1,0.0,0.0,0.0,178.2,0.0,0.0,0.0,0.1,0.4,1.0
"ROU Motion picture, video and television programme production, sound recording and music publishing activities; programming and broadcasting activities",0.1,0.2,0.6,0.1,0.0,0.1,0.0,1.2,0.2,0.8,0.8,0.1,0.0,0.3,0.0,0.4,0.0,0.2,0.1,1.3,0.0,0.1,0.0,172.8,0.0,0.0,0.0,0.7,2.5,6.1
ROU Telecommunications,0.3,7.4,8.9,9.0,0.0,0.2,0.4,31.8,38.4,15.2,28.3,23.9,0.0,0.3,0.9,100.7,2.7,0.1,0.1,26.1,0.8,1.2,2.3,3942.5,0.6,1.8,0.0,0.7,28.7,38.0
"ROU Computer programming, consultancy and related activities; information service activities",0.0,0.1,0.1,0.6,0.0,4.1,0.1,17.8,0.9,4.8,2.1,1.5,0.0,0.1,0.0,3.2,0.1,0.0,0.0,4.5,0.6,1.6,0.1,2946.3,0.0,0.0,0.0,3.4,23.7,85.0
"ROU Financial service activities, except insurance and pension funding",0.0,1.4,0.1,0.1,0.0,0.7,0.0,13.8,2.3,10.9,5.0,1.2,0.0,0.0,0.6,1.5,0.0,0.3,0.0,6.3,0.4,0.1,0.2,552.0,0.0,0.4,0.0,0.3,6.1,59.9
"ROU Insurance, reinsurance and pension funding, except compulsory social security",0.2,5.2,0.4,1.6,0.0,0.0,0.0,3.3,1.1,1.0,3.4,1.1,0.0,0.3,0.6,5.8,0.0,0.1,0.0,0.2,0.1,0.3,0.0,388.2,0.0,1.6,0.0,4.1,25.0,52.2
ROU Activities auxiliary to financial services and insurance activities,0.2,4.7,0.4,1.5,0.0,0.0,0.0,3.4,1.1,1.2,3.2,1.0,0.0,0.3,0.6,5.3,0.0,0.1,0.0,0.4,0.1,0.3,0.0,456.3,0.0,1.4,0.0,3.7,22.7,47.5
ROU Real estate activities,0.0,0.3,0.2,0.2,0.0,0.1,0.1,1.9,0.4,2.5,0.4,0.4,0.0,0.2,0.1,1.4,0.0,0.0,0.0,0.4,0.0,0.4,0.0,15846.5,0.1,0.7,0.0,0.2,0.8,2.4
ROU Legal and accounting activities; activities of head offices; management consultancy activities,0.0,0.7,2.5,0.6,0.0,0.5,3.6,2.0,3.6,4.6,0.6,0.2,0.0,0.1,0.0,4.3,0.0,0.0,0.0,12.0,0.7,3.1,0.1,240.7,0.0,0.0,0.0,2.9,7.6,12.2
ROU Architectural and engineering activities; technical testing and analysis,0.0,0.1,0.0,0.1,0.0,0.1,0.0,1.0,0.1,0.3,0.2,0.1,0.0,3.3,0.0,1.0,0.0,0.0,0.0,0.2,0.0,0.1,0.0,479.5,0.0,0.1,0.0,0.2,1.0,12.2
ROU Scientific research and development,0.0,0.5,0.6,0.6,0.0,0.2,0.3,4.3,0.4,3.4,0.4,0.7,0.0,0.0,0.0,1.3,0.0,0.1,0.0,4.3,0.0,0.1,0.0,979.8,0.0,0.0,0.0,1.3,10.3,0.9
ROU Advertising and market research,0.0,0.0,0.1,1.0,0.0,0.0,0.0,0.2,0.1,0.1,0.4,0.0,0.0,0.1,0.0,0.1,0.0,0.0,0.0,1.5,0.0,0.0,0.0,73.6,0.0,0.0,0.0,10.1,1.6,12.2
"ROU Other professional, scientific and technical activities; veterinary activities",0.0,0.1,0.1,0.0,0.0,0.1,0.0,0.7,0.1,0.2,0.2,0.1,0.0,0.1,0.0,0.3,0.0,0.0,0.0,0.3,0.1,0.1,0.0,199.2,0.0,0.1,0.0,0.2,0.7,5.2
ROU Administrative and support service activities,0.0,0.9,0.4,0.3,0.0,0.4,0.2,5.2,0.9,2.8,3.2,1.0,0.0,0.4,0.1,8.8,0.1,0.0,0.0,1.2,0.2,0.5,0.0,1955.5,0.3,0.4,0.0,1.2,2.4,6.5
ROU Public administration and defence; compulsory social security,0.0,0.0,0.0,0.0,0.0,0.0,0.0,0.0,0.0,0.0,0.0,0.0,0.0,0.0,0.0,0.0,0.0,0.0,0.0,0.0,0.0,0.0,0.0,10281.8,0.0,0.0,0.0,0.0,0.0,0.0
ROU Education,0.0,0.0,0.0,0.0,0.0,0.0,0.0,0.0,0.0,0.0,0.1,0.0,0.0,0.0,0.0,0.0,0.0,0.0,0.0,0.0,0.0,0.0,0.0,5861.2,0.0,0.0,0.0,0.0,0.1,0.4
